city,state,date,lCCN,text,title
['Cincinnati'],['Ohio'],19170602,sn88077379,"MMMSiiigS2Z22IHnJ
--i'OBtoJii-
. ij6iLmfar -""--,. J -- iiwmk41 .. .:. . r J"""""" ,
r
O! i: A VTE
J'. IN .. Vil
1 IRRARY
INDEPENDENT
NON-PARTISAN
ZWBB'
Property and Official Organ of the Building Trades Council of Cincinnati and Vicinity
Vol. V. No. 7
CINCINNATI, OHIO, JUNE 2, 1917
One Dollar a Year
M
M'li
l!i
I
IH
hi
M
Alfred G. Allen Nominated
by the Democratic Party for Mayor of Cincinnati. Allen is a St , Candidate
Voted in Favor of Organized Labor, and Against Prohibition on Ei jry Question
That Came Before Congress Daring His Six Years of Service.
Yielding to the pressure of personal
and political friends, former Congress
man Alfred G. Allen, decided to accept
the Democratic nomination for Mayor
of Cincinnati, at a conference Thurs
day morning with the committee ap
pointed to select a municipal ticket.
The same influence that swayed Mr.
Allen induced former Vice-Mayor Sim
con M. Johnson to he the candidate for
his old position.
When the committee convened' in the
office of Mr. Johnson, with all the
members and Mr. Allen present, the
follow letter was read :
""To the Members of the Special Corn
following letter was read:
""Since I retired from Conercss I
have enjoyed the practice of my pro
fession and the peaceful life of a pri
vate citizen, and have looked forward
with genuine pleasure to their continu
ance. For this reason I have discour
aged any mention of my name for the
office of Mayor. However, I am not
unmindful of the fact that present con
ditions demand that personal wishes be
mittee and others have caused me to
feel that the City of Cincinnati is en
titled to whatever experience and abil
ity I may have for public service.
""Therefore, if it is desired that I
become a candidate for Mayor, I will
accept the nomination with sincere ap
preciation and gladly offer to my fel
low citizens the best that is in me.
""Sincerely yours,
""Alfred G. Allen.""
Announcement Is Applauded.
Loud applause greeted the announce
ment that Mr. Allen had consented to
be the mayoralty candidate. Members
of the committee grasped his hand, and
for live minute there was a scene of in
tense jubilation, which was intensified
when Simeon M. Johnson agreed to
run for Vice-Mayor.
Later in the day Mr. Johnson issued
the following statement;
""This is the day when men must re
spond to calls for service. My personal
preference has always been to remain
in the ranks of the workers and help
to elect an able and popular Democrat
of whom there are many to serve as
Vice-Mayor. If, however, by reason of
previous experience my party feels that
1 can be of any service in that posi
tion, then I shall' cheerfully respond to
the call, and shall do every thing in my
power to further good government for
Cincinnati.""
The other offices on the ticket will be
chosen within the next 48 hours, and
it is expected the full ticket will be re
ported to the City Central Committee
at its meeting Saturday afternoon. Since
the acceptance of Mr. Allen there is a
rush to get on the ticket with him.
Democratic leaders are much pleased
that former Mayor E. J. Dempsey, who
it was feared might enter the primary,
declared his hearty support of Mr. Al
len, whom, he said, ""was his warm, per
sonal and nolitical friend.""
Alfred G. Allen was born at Wilming
ton, Clinton County, Ohio, July S3, 18G7,
and will be 50 years old next month. At
the outbreak of the Civil War his fa
ther; Isaac Allen, was prosecuting at
torney of Clinton County. He resigned
his office, organized Company C, Seventy-ninth
Ohio Volunteers, was elected
its captain and fought in the war until
lie lost his health through exposure.
Alfred G. Allen studied at the Cin
cinnati Law School and was admitted
to the bar in 1890.
In 1003 he was elected a councilman-at-largc,
and from 1908 to 1910 he serv
ed ?s ?. member of the Sinking Fund
Trustees, where a high order 'of busi
ness discernment is required.
He was 'first elected to Congress in
1910 and served three terms. He dis
tinguished himsejf as a member of the
postofficc committee and helped draft
subordinated., to calls to .public service.
ayi!mo'tfSA;r9
s&S??'
W!PWMMKHMIWIIMgiJjWiPWJgJjjgJp-&3g3.
IBUBUBBBiBBMBlBBBBBBiMBiiMiMMI
HON. ALFRED G. ALLEN
Democratic Candidate for Muyor Allen Voted for Every Labor Hill and
Against Every Prohibition Itill During Ills Siv Years of
v Service in Congress.
---
9-
'Twill Grow
I
THK LAW AGAINST SELLING LIQUOR TO SOLDIERS HAS I
T ALREADY PRODUCED A NUMBER OK BOOTLEGGERS. WHAT
T WOULD IT BE IP WE HAD STATE-WIDE PROHIBITION?
-M-f-H-f-f-f-f-H-M-f-f-M-f-C-f -""""
the parcel post bill. In his last term he
was a member of the ways and means
committee, which practically runs the
government. I
Allen is married, has three children
and lives at 710 Elbcron avenue, Price
Hill.
He is a member of the Price Hill
Lodge of Masons. Also he can sini he
being a member of the Orpheus Club.
He belongs to the Price Hill Methodist
Church.
Last year he refused to be a candidate
for a fourth term. He is a member of
several social and civic organizations.
""Until Tuesday afternoon I had fully
made up my mind not to accept the
nomination for Mayor."" said Mr. Allen.
""The talk of former Governor Harmon,
of the committee, impressed me deeply
and did a great deal to induce me to re
verse my decision.""
Mr. Allen is a member of the Military
Draft Board and he was undecided
whether or not he would resign. He
probably will do so.
When Simeon M. Johnson was elect
ed Vicc-Mavor in 1911 he did the un
usual by asking that the salary of his
office be reduced one-half from iffi.OOT
to $3,000 a year and the Vice-Mayor
has received compensation at the latter
figure since.
The Times-Star, a strong Republican
paper, speaking of Mr. Allen, editorially
savs :
""Mr. Allen made a god record as rep
resentative of the Second District in
Congress. He has always, been careful to
keep his political fences in repair, wliich
means that he has many .friends. Un
doubtedly he wilt make A strong race
this fall. ' ' . ,
The Times-Star has more ronlidpp-c
in Cincinnati Republicans than in Cin
cinnati Democrats. 'Wi, believe- y$.
save under exceptional conditions, the
Like Weeds!
citv is better off under Republican than
under Democratic rule. On this account,
and because Mr. Galvin is a strong can
didate at the head of a strong ticket, we
expect to support the Republican ticket
this year.
Still we arc not going to spend the
next five months in throwing mud at
Mr. Allen. His nomination means that
both parties will be creditably repre
sented in the fall campaign. That ought
! to mean a vigorous and accent cam
paign, with the city safe in any event
from a disastrous mistake at the polls.""
WORKERS TO SELECT OFFICIAL.
Little Rock, Ark. Coal miners of this
state will select, by a referendum, the
state mine inspector, and the executive
board of the state federation of labor
lias issued a call for the preferential
ballot. Before election candidates for
governor favored, this plan. Nomina
tion blanks -have been mailed to all lo
cals of the United Mine Workers,
TEAMSTERS RAISE WAGES.
N'c' London, Conn. Teamsters' Uu
irn No .')5 has secured a wage agree
ment wliich r'ses wages and improves
v'-rkir.T conditions. Arbitration pro
visions ar included and one man in each
stable will be recognized as a representa
tive of the union.
HOSIERY WORKERS RAISE
WAGES.
Philadelnhia. About -100 hosiery
workers, affiliated with 'the United Tex
tile Workers, have increased 'wages 20
rer cent as a result of conferences with
the Hosiery Manufacturer', association.
The agreement provides for union recognition.
How To Keep Your Meats
With or Without Ice, Explained by the Members of Meat
Cutters Union, After Several Tests Made by a
Committee of That Organization. Simple
and Cheap Processes Explained.
The Meat Cutters desire to answer i
the housewives as how to keep meat
over Sunday. It seems to be a difficult,
matter for the meat cutters to secure
one day's rest in seven, and a few of !
the housekeepers claim that they can not
afford to purchase their meats on Sat- I
urday, because they have no ice box and
therefore can not keep their meat from
Saturday until Sunday morning. The j
meat cutters wish to say that it shows
a lack of knowledge for any one to
make such a statement, as the following
facts will show:
The meat cutters made a test of sev-1
cral methods of keeping meat for at
least twenty-four hours. A small ice
box was secured and a j-cent piece ot
ice and a dollar's worth of pork roast
and seventy-five cents' worth of beef
roast were placed therein. The ice and
meat were nlaced in. the box Wednes-
f33yTmorningi'Mayi3U,and-,ou May.31,
-at o?3up, m.,"",-the meat wasremoved;
there was still a little ice left in the box
and the meat was just as good as when
it came from the meat store.
Another method of keeping meat was
tried on the same day: a ten-cent piece
of ice was placed in a small wash tub,
on top of which a pot roast costing $1
and a pork roast costing $3.03 were
placed on a plate and covered with news
paper and on top of the newspaper was
placed a small table-cloth. The follow
ing day,"" May 31, at .) p. m., a small piece
of ice remained and the meat was just
as good as when purchased at the store.
A third and cheaper method was tried,
in which a good-sized pork roast and
also a beef roast were tried : Two
towels were placed in vinegar and then
wrung out. Each roast was wrapped in
a towel and then then wrapped again
in a niece of newspaper. This took place
Wednesday morning, Mav 30 at S :30
a. m., and on Thursday, May 31, at 1 :30
p. m., the committee met and looked
OPPOSE COOLIE IMPORTATION.
San Francisco. The labor council has
passed resolutions in opposition to the
importation of coolie labor and calls
on all advocates of American standards
to take similar action ""to counteract any
contemplated or attempted changes in
existing laws to restrict or regulate im
migration."" It is declared that those responsible
for coolie importation agitation are in
capable of appreciating the benefits and
advantages of a ""white man's govern
ment."" ""It is manifest,"" the resolutions say,
""that certain selfish and reckless persons
in this state and elsewhere, pleading the
emergency of our national crisis, are
making injurious efforts to break down
and nullify the hard-won federal legisla
tion to restrict and regulate immigration,
and are already clamoring before con
gress to have it throw-down the bars and
permit the importation of 100,000 coolies
to harvest California crops.
""The question of Asiatic immigration
has been fought out and settled for all
time in favor of the white man, andour
national policy of exclusion of Asiatic
laborers should be able to stand the
strains of war and national peril, as well
as those of peace, come what may, as
long as the American people and Ameri
can workers stand ready to make all
necessary sarrifres in defense of the
nation and the interests of humanity.""
Affiliated unions arc asked -to adopt
similar resolutions and forward copies
to the officials of their respective states,
their national senators and congress
men and the public press. ' '
over the meats, which were found to be
just ?s good as when placed in the
vinegar-soaked towels the day, before,
and there was no danger of the meat
spoiling for another twenty-four hours.
This was accomplished without ice, the
meat being wrapped in vinegar towels
and then wrapped in newspapers.
The above illustrations go to prove
that our statements are correct and we
arc satisfied to have any government
meat inspector or any one of the officers
of the board of health look into these
statements and we wilt prove that we
are correct.
I The meat cutters are trying to secure
one day rest in seven. The reason that
1 some people must go to the butcher
j shop or grocery on Sunday is not be
( cause they can not afford to purchase
l their meat on Saturday, but because thev
do not want, to as long as they can buy
rthcir ments-and groceles on Sun 5
I These folks do not realize that they are
J making slaves out of some human be
! ings bv having them work on Sunday.
Sunday was made for rest and the meat
cutters are entitled to this Sunday rest
the same as other people, so let us be
friendly in this matter.
We trust the readers of this article
will tell their friends or others about
this method of keening meats from Sat-
I urday until Sunday without spoiling, as
the abo e statements are very plain and
simple.
Trusting that the people will be very
reasonable with us from now on and
ill give this matter careful considera
tion and purchase their meats, etc. on
Saturday instead of waiting until bun
day; we also trust you will give us your
moral support and thank you for jour
co-operation.
Respectfully yours,
Henry"" Djnporf, Secretary,
Meat Cutters Local Union Xo. 010.
BUILDING TRADES COUNCIL
Endorsed the Liberty Loan mid Re
quested the Locals to Invest in
the Same Only Routine Business
Transacted.
The regular meeting of the Building
Trades Council was called to order by
President Jos. A. Cullen.
The roll was called and absentees
noted.
The minutes of the previous meeting
were read and approved.
A communication from the Electrical
Workers, Local No. 213, stated that
Brother L H. Smith had been elected
a delegate to the Council. Brother
Smith being present he was duly obli
gated and sea'ted.
A communication from the Liberty
Bond Loan Committee was read request
ing the Council to invest in Liberty
bonds, wliich was referred to aH affili
ated locals with the recommendation of
the Council.
The minutes of the Board of Business
Agents were read and concurred in.
The report of the Business Agent was
read and approved.
All trades reported business good.
There being no further business, the
Council adjourned.
WIN FOUR-YEARS STRIKE.
Portland, Ore. The Home Telephone
and Telegraph Company has accepted
the wage scale and working rules of
Electrical Workers' Union and this
strike, which started May 5, 1913, is at
an end Because of its opposition to
organized labor the company's business
was- hard hit.
t
If
m",The labor advocate. [volume]
