city,state,date,lCCN,text,title
['Las Vegas'],['New Mexico'],19061005,sn86063592,"VEGAS BADLY OPTIC
VdXXVU
LAS VEGAS. NEW MEXICO. THURSDAY. OCTOBER 5. 1906.
No. 284
STORM KING LEAVES DEATH AND DESTRUCTION IN PATH
THROUGH SOUTH TO CLASP US IN HIS CHILLY EMBRACE
LAS
3 TORNADOES
THRO LOWER LOUISIANA
Four Reported Dead at Pentchatoula and Heavy Property'
Damage
ze. Tremendous
Disturbance Occasions Great Excitement. All lines
Prostrated and Negroes Blown Bodily Away. Death
Reports from Lake Unconfirmed. Houses Demolish
ed and Rink Destroyed.
Xew Orleans Oct. 5. There were at least three sqaraic
trnalie in the vicinity of New Orleans today. htclnlmg tltat
which struck tbi city. A sjiecial from Hammond, lmisiana. n
the Illinois t'cnlnil railn rul. alunit fifty miles from Xcw Orleans
says that a toroalo struck I ""cut chatoula. near here this morn
ing, ami lil hcasy damage to rojHTty ami killed four itcojile.
A mnnljer are injured
A tornado crossing over near Amlilxtn trk swept in a north
westerly direction oxer the city. crsinjj the canal on the wot id side
of (lailiorne. It was preceded hy a thunderous noise. Along
its whole path f three miles or more damage was done. Tele
phone and telegraph poles are prostrated and communication w ith
many parts of the city is rendered itnisillc. TX'hris strewn along
the tornado's track put the Peters a venue car line temporarily out
of Im-ines. At Tolcdano and Saratoga streets a new market in
prices .f construction was leveled.
Neqroet Blown Away
Klve new residences In that neigh
borhood were rasttd. Negroes la
Itouslas square were picked up bod
fly and blown vway. gome damage
&a done ut th gas works In the
rear of the third ward. Much dam
ase was done tit an oil mill In th
same neighborhood. A warehouse
at Utterly and I'oydras streets is
blown down and a heavy Iron car
turned upside down tint there.
Another Tornado at 8 a. m.
Xew Orleans. Oet. 5. A small tor
nado passed diagonally urosn the i
7TTtj:::i:z:::r:zauZ
lng down fences and doing other
damage. No one l rriioried Injured
in the tornado which crossed the riv
er about Jena street in the uptown
district and cut across to the rear of
the third v.-ard one side of which I
hounded by Canal street. The air was
filled with flyinu planks and other de-
brls. Great excitement was ennsed j
In the districts affected by twlstln ;
wlm,s-
Death Reports unconfirmed
Vbtc OrIiaii) flrt S. A renort
brought In from the neighborhood of j
Iake Pontchartrain. outside of the j
city limits. Is that lives had lteen lost j
there. Later, the death of a man
named Howes was reported tit the
lake, but these reports lacked confir
mation. Although several death Re
ports reached Xew Orleans after the
storm. Investigation showed that pro
bably not a life was lost here. Many
of the injuries occurred near Roberts
street and the ilver front, where tba
Columbia oil mill and Jefferson saw
mill were badly damaged. A woman
and child were injured by the blowing
down of a bouse at First and Magno
lia streets.
. The wind was accorapanf.etlfey. a
low hanging cloud and &feesY ara
ble. It traveled ,neruiwa(. until it
reached the fine residence portion of
the city at St. Charles street and Na
poleon avenne. Here the damage was
the lightest done in any part of the
tornado's course. From St. Charles
street the wind proceeded straight
ahead to Marengo and Carondelct
streets, where It steered sharply to
the northward and in this direction
passed out of the city. The path of
the tornado through the city was
thirty to fifty feet wide. This nar-
row street was strewn with bricks j
from demolished chimneys, detached
boards, uprooted trees, felled te!e
egraph poles and an occasional roof.
It was the falling of these objects
which caused the most injuries.
peculiar feaare of the disturbance la
the city was the fact that few per
sons within a half mile of the torna
do's path knew there had been a
storm.
New Orleans. Oct, 5. Further re
port of the tornado Indicate that a
number of house were blown down
by the wind in different parts of the
TWIST
Noise Preceding New Orleans
city I Iiir In the track of the storm.
Al PiiKt ami Magnr Ha streets a house
Is n'HiriMl demollKhcd and a woman
r.nil child tteverely hurt. The factory
at Krato and Magnolia Ktreet in also
reported id have suffered severely
The .liilalal tik'itliiK rink at I'.slin
and OaroudcM Hlwig Ik blown to
IiUhm'm mnl th ili'.ulh from It scat
tered In every direction. As the re
port come In. damncest In way if
hense destroyed Increase. There
are reports also of people hurt hy
flying timbers.
"" """" ""
cotton takes
UPON NEWS
(bulletin.)
New Orleans Oct. v
The
r.M
upon news ot 4hc tornado in this
city. I K'cetnlicr. which closed yes-
itertlav at 10.11
went to 1 1.J4.
while lamiarv rose from io.jo to
the same price later. Decetultcr
fell to 1 and January to M. iJ.
- -
Xew York. Oct. 5. The cot
ton market opened strong and ex
cited at an advance of 17 to
36 points, which carried prices to
a new high level for the season as
a result of much higher Liverjiool
cahles than were exjtected. The
uncovering of stop Joss orders of
the short side and the broadening
speculative demand, had weather
6 KILLED, 12 HURT IN
TERRIFIC EXPLOSION
THREE OTHERS; BURIED UNDER
EARTH IN WRECKED SUBWAY
ILLUMINATING GAS DID IT.
Philadelphia. Oct 5. The terrific
explosion of illuminating gas in the
subway of the Philadelphia Rapid
Transit company under construction
at Sixth and Market streets todav
killed six men, injured about a dozen
others and caused projtorty damage
that will run Into thousands of dol
lars. Besides six men known to be dead,
it Is said that al least tore tit Hers
are buried under tons of earth in the
wrecked subway.
The identified dead are:
John Lawless, foreman for the Con
ti.ruction company;
Frank Leant, employe of the con
struction company.
R. Capero. an employe of the con
struction company.
IIEIt JUDICIARY
BADLY DOSSED
fCHAt. B- MAGOON TO RELIEVE
I THE STRAINED CUBAN
SITUATION.
FOR A FAIR ELECTION
' wir
pleasantness"" iff Island Where Pee
pic Have No RtcotirM.
Washington CXi. .Tlie de
termining; factor in the election f
(inventor Charles Ik Magoon as
provisional governor of C'nlia was
the fact of his familiarity with all
tlte laws of Culia ami tlte ttqs
that were taken during the last
uterican intervention to organ
ize a stahle goveninient. It has
already lteen letertniued that there
must lie an election anl the ma
chinery for a fair election must lie
constructed hy the provisional
governor. i
ll'lHCIARv's tN'UKI'KMiKM K
Another feature of the work
that will deo1ve upon (Jovernor
Magoott will lie in securing im
provement in the laws of Cuba
with regard to the itulejiemlettce
of the judiciary ami the sttWr
vieucy of the judiciary to pulitical
Nwcr. which -is one of the causes
of the present trouhle. Persons
aggrieved over the methods of
tins government have no redress
through the judtcjary Uvattse the
judiciary was not granted suffi
cient tndeKMtdence of iolitic;il an
tln.rittes. It is the intention of
this government, according to ad
vices here, to have such an im
provement of the present laws of
the next t'nltan government as
vi!l materially decrease the rea
sons for revolution and another
intervention hv the I'nitcd States.
sudden rise
OF TORNADOES
in the south ami the report of the
size of Octolter slmrls were hull
factors. There was tremendous
realizing' on the advance hut the
offerings were taken up ami the
prices held. The initial advance
with May selling was 11 cents.
One of the features was an ad
vance of 77 points for Decemltcr
contracts in Xew Orleans.
Washington. Oct. 5. The cen
sus bureau today issued a bulletin
showing the quantity of cotton
taken for consumption by manu
facturers and the amount consum
ed during the year ending August
1 last, to have liccn 4.871.169
liales, leaving the amount held by
manufacturers f75.)87 bales.
NINETEEN DEAD TAKEN
FROM WEST FORK MINE
(Bulletin.) -Roanoke,
Va., Oct. 5. A tele
gram received here states that up
to 1 1 o'clock this morning- nine
teen bodies have lteen recovered
from the West Fork mine at Po
cahontas and it is thought there
are still forty in the mines. There
is no evidence thus far of fire and
the work of rescue is not retarded.
It will probably lie two days be
fore all the Ik Klies are found.
MOBILE, ALABAMA.
EXPECTS HEAVY GALE
Moiilie. Ala.. Oct. a. I p. m.
There has been no storm In or near
Mobile at this hour, but the wind is
bio wine; thirty miles an hour tn the
lower bay with rain falling;. The wind
Is exiiected to reach the same veloc
ity In Mobile, accompanied by raiu
and IlKhtuing.
CHINESE PHE5S
AGJA
CONSTRUCTION BID PROPOSALS
EXAMINED IN LIGHT OF PE
CULIAR CONDITIONS
ONE LjSE IS ENOUGH
Seventy Five Per Cent of Chinks
Who Worwetf for French Company
Died Authorities Petitioned to
Forbid Immigration.
Washington ). t. Oct. 5.
Officers of tlte Isthmian (anal
commission are iHisily engaged x-
annning prtmsals recently sttln
mirted by contracting firms for
furnishing Chinese lalmr for work
on the canal al lanania. lle
cattse of the tecttliar com lit ions
surrounding transportation ami
the employment of aliens in the
work c Hitemplated. the adjust
ment of some international fea
tures will proktblv arise. Sev
eral weeks must necessarily elapse
liefore any conclusions are reach
ed ami the contracts are awarded.
II Vl KOKMKH KM'KRItXt K
Some doubt is expressed as to
whether the contractors will lie
able to carry out the contract
which may lie awarded for stii
plving coolie lalsr.
Preferably mi account of the
climatic conditions the Isthmian
commission desires that any la
Imrcrs sent to the isthmus shall
come from the southern provinces
ofU'hina. Section resrts at the
Chinese fegatiofi show that not a
single Chinese newspaer favors
the emigration of Chinese to Pa
nama as the eeriences of those
who went there for the French
canal company are still fresh in
the minds of the jieople. The
Chinese were unable to withstand
the conditions then existing and
it is said that alxmt seventy-five
ht cent of those who went there
died. Petitions from Chinese res
idents in Peru. San Francisco and
at Panama have lieen si-nt to the
government at Pekin asking that
it refuse its sanction to any projHi
sition promising to permit con
tract laborers to go from China to
lanama.
Thus far, however, the Chin
ese authorities havc refused en
tirely and are passive in the mat
ter. A suggestion has I teen made
that if the Chinese government
interposes an objection to permit
the departure of coolies for lalmr
on the isthmus, the contractors as
an alternative may resort to the
Philippine Islands or the Straits
Settlements, near which the Chin
ese government has mi jurisdic
tion, for lalmrers. Any contract
for furnishing coolie lalmrers
which may lie drawn by the Isth
mian Canal commission w ill, lie
fore being executed. !e submitted
to the state department for inspec
tion with a view to avoiding any
possibility of international com
plications.
RECEPTION POSTPONED .
.UNTIL THIS EVENING.
The reception and musical pro
gram at the Normal university
last night was postponed until this
evening on account of the inclem
ency of the weather. In spite of
the snow and rain, almut three
dozen jieojile gathered in the as
sembly room of the institution
last night ami listened to an im
promptu concert by Misses Maljel
F. Clench. Lora L. Holmes ami
Adelaide Franz. The cntertain
men was an exceedingly enjoyable
one and the young ladies were en
cored again and again. The regu
lar program was not touched up
on. Excellent refreshments were
served.
HEM SNOW
DOES SERIOUS DA W
Storm Area Extends from Lamy to Trinidad. Eight inches
of Snow Falls. Telephone Wires Grounded and
Telegraph Service Badly Crippled North of Vegas.
Cam Dispel from Spring. ' HeavyShow
ers Precede Snow Storm Which Damages Roofs,
Fruit and Shade Trees. 1 .04 Inches Precipitation.
One of the heaviest and most damaging snow storms with
in the memory of the ollet inhabitant fell in Las Vegas and
vicinity from half past six until after eleven o'clock last eight.
The fall is estimated at eight inchc here; it is Raid to have
been heavier in the mountains. Telephone wires were ground
ed, trees giving way beneath the
ing acrcms the wires. This morning telephone communication
is shut off between Las Vegas and all neighlmring cities with
the exception of Albuquerque and Santa Kc. Local telephones
suffered on both systems, the Colorado being damaged the
most. It was late this morning before any kind of service wait
reestablished. Both the Western Union and the Postal tele
graph companieH report their wires damaged north, although
not sufficiently to entirely interrupt service. Considerable
damage to orchards is rctorted.
Extendi From Lamy to Trinidad
At tli Mailt I Kc 1 vision ofrirM
litis uiorniiix, rt(Mrtn liml been re
ceived that I lie Htiow turill 4 ItkA
night fxmiitleil Imui Lamy Ui Trlnl
dny, lietajj mi;h luai tip mirth
than lHro. It was repun4 that 200
kI'b of the PMal company wr.i
down ! wfn Maxwell City and Wat
num. Howevt-r, It was thought that
th rnilrond wl.i-a would Ik' working
an usual hv ih nilildli of the after
noon. Dispersed Crowds at Springer
rrson arriving from HirlnKr latf
Inttt nlRhl on No. "". which was dt'lay
eel Kveral Ihmith Ix-eaume It eoiitainwd
fonrtwn earn mid with only one en
Rlno to draw It. say that tb t'nloti
fair at that plaro ntartl off nicely.
The I'xhlliltH anl raoo wr tip to ex
IHTtailoitH and tin- attendant-; wa
quite large. Howvtr, a heavy down
IMnir of rain Kirtirk tltox part at
S:r.ti yesterday nflrnoon. followwl by
a snow Htorin. which dlHKraod th
eathirltig In short ordr and iirolta
ly put an nd to the fair. Many f
th ram-hmr-n and atoeknipn in at
tendance have Kon to thidr homes to
care for their crops and stock. 4
Preceded by Heavy Rain
lically. the unow storm was pre
ceded by heavy showers of rain,
which fell Intermittently rrotn thwte
o'clock yesterday (Thursday) after
noon, when the mionv hegan to fall
heavily that it soon covered every
thing. The fall was very wet and
melted rapidly. By noon most of the
snow had disappeared except In tiio
hills and mountains, which are snow
capped.
Twenty-two hundredth of an Inch
of rain fell yesterday before six o'
clock and the precipitation for the
rest of the nlRht measured eighth
two hundredth of Ml, inch;,-making
1.04 inches of , acittatftrelpltaflon.
Snow laid on th R'r&ifitd fhla ntorn-i
tag at depth of Inuf.lnchea.
Shade and Fruit Trees Oamaged
Both fruit and shade treea suffer
ed heavily from (he weight of the
snow and the flat roof of native
houses are reported to have been
damaged considerably in several in?
stances.
Up to the present time little frost
had nipped the tree leaves which
were still thick and green. The wet
snow drops stuck to the foliage and
pedestrians on Las Vegas streets last
niKht could hear the snapping of
breaking bougbs In any direction.
The crashing of limbs and the noise
made by falling pole kept people
awake all over town last night and
some Instances have been learned
where the women were so frightened
that they were unable to sleep.
Dr. P. E. Olney, who owns ranch
three miles from Vegaa on the Mori
road, reported this morning that
vy snow fell in that vicinity,
much damage resulted from tie hea-
""I did not make close tnvesttga
Hon,"" be told The Optic this morn
ins, ""nt 1 saw numbers of fine ap
Ml
weight and great Hubs fall
ple trees, some of them eight years
old. broken down under the snow.""
One rltUen got up last night befora
midnight and putting a slicker over
his scant attire, got a heavy poke snd
bumped the young ahade and fruit
trees In his yard. He was covered
with several carloads of anow before
his work was done, a sufficient per
cent sliding down bis nock tn prevent
bla sleeping for the rest of the night
Thla morning after a miserable
night's rest he got up to gloat over
his neighbors and found bla trees
stripped like cornstalks, the later
snowa having clung even closer that
the first.
Street Almost Impassable
Probably the worst damage in Lae
Vegas was on Eleventh street aa far
up as National avenue, tn one block
several telephone poles are down and
a tangled mnss of wire and tree
limbs made the street almost Impass
able this morning. A force of lino
men were engaged In making repairs
to the broken lines this morning and
removing the dehria. Owing to the
danger in handling the wires the Lae
Vegas Electric Railway and Power
company, at the request of Mayor K.
D. Ooodall, ishut off the current
In a part of the wires until the trou
ble was adjusted. The power com
pany suffered some slight damage to
their poles and wires at Eighth and
Columbia avenue, but they expected
to have this remedied at noon. All
the cars are running today, but tb
light power has been shut off. It wag
reported at the power house thla mor
ning that all the power will be on
late this afternoon.
Plaza Trees Down
Great damage was done In the town
of Las Vegas last night by the heavy
gnow fall, .Hairy of the tree in tha ,
Plata park are almost ruinedjand the;,'
beautiful court house lawti-la-ooyered.
with great limbs of trees, which.- bad ""C
successfully weathered tho storms of .
years. Many of the fine shade trees i.
on Hot Springs boulevard are merely
scarred atumps ,-bereft of their fol-;
lago, and the damage at the beautiful
home ot Jefferson Raynolds Is par
ticularly severe. , .
Telephone wires hung across the
sidewalks and streets and In some in
stances telephone poles were snap
ped off Just above the ground and lay
wrapped in a tangled mass f wire
In the thoroughfare.
The street car, telephone and tele
graph companies In a few days will
be able to tell in dollars and eenta ,
bow much the snow storm of last
night cost them, but the damage done
to the parks and beautiful shade
trees of the city can never be esti
mated. ""v - - '
The fine, old poplar trees, older
than the city of Lag Vegas, which
stand lu front ot the . Graaf. Clark,
Delden and Maloney homes on Na
tional avenue were stripped by the
heavy burden of snow last night s ,
If they had stood in the path of s cy
clone. Limbs strew the lawns. ;
1",Las Vegas daily optic. [volume]
