city,state,date,lCCN,text,title
"['Carson City', 'Carson City']","['Nevada', 'Nevada']",19191108,sn86076241,"Bail it Appeal
City
TO MAKE KNOWN THE RESOURCES OF .NEVADA
VOL.LVI.
25 cents pir week
CARSON CITY, NEVADA, SATURDAY, NOVEMBER 8, 1919
Five cents per copy
No. 264
' H II
will
Federal Judge Makes Quick Work
of Injunction Case :
IBy United Press
INDIANAPOLIS. Nov. 8. Judge
Anderson today ordered the miners' of
ficials to withdraw their strike order.
The judge also made a restraining or
der preventing them from furthering the
strike under the temporary injunction.
The union leaders were allowed until
6 o'clock, November 11th, to withdraw
the strike order. The judge interrupted
the arguments pf the attorneys for the
miners to state his mind was made up
on the questions involved. He said : ""I
think this is the most lawless thing I
ever saw in my life. I consider this re-j
bellion. The government is supreme
even to the la1xr unions.
to Ms Up to the He
Bt United Press!
NEW YORK, Nov. 8. Forty-eight
men and two women are under arrest
as a result of a nation-wide round-up
of alien radicals. They are charged
with being alien criminal anarchists.
Will Be Home for Turkey
By United Press
-PARIS, Nev. 8. General Conner has
announced that the last of the American
doughboys in France will be. home by
Christmas. All activities of the Ameri
can army in France will cease Decem
ber 1st.
President Coates of the Washington
State Federation of Labor said today :
T am opposed to the importation of
cheap labor, whether Chinese, Japanese
or otherwise. American labor lias rais
ed the standard of living which will be
endangered if cheap labor is imported.
N VZ rv CZ TT
)H
i it
Governor Boyle this morning receiv
ed the following night letters, dated
Tonopah, November 7th : , . ' .'
""Emmet D. Boyle, Carson City, Nev.
Through your suggestion and efforts
I am pleased to state that the mine
operators and mine and mill workers'
organization of Tonopah and Divide
have come to a Satisfactory settlement.
I wish to thank you for our organiza
tion, and personally for the successful
termination of this difficult problem.
""J. B. BYRNE,
President Tonopah and Divide Mine
and Mill Workers' Union.""
""Governor E. D. Boyle, Carson City,
Nev. Agreement reached tonight be
tween miners and operators. Will be
here for several days yet. When can
you go to Ely. Thanks for your good
work at that end.
-JOSEPH LORD."" x
A Small Majority
Br United Press
-COLUMBUS, OhioV Nov: 8: The
drys claim that the wets have but a ma
jority of one vote out of nearly 1,000,000
in Ohio s ratification of the national
prohibition amendment. Complete, but
unofficial, returns are in.
End In Sight
Bt United Press
SAN PEDRO, Nov. 8 The end of
the ship yard strikes in the Southern
California district was seen today when
it was announced that the boiler mak
ers union, the largest union in the
yards, voted to return to work Monday
in theyards of the Los Angeles Ship
building and Drydock company.
Make Big Haul
Br United Press
SAN FRANCISCO, Nov. 8. Robbers ;
Main Witness Dead
By United Press
OGDEN, Utah, Nov. 8. Carl Cole,
the ortry one of the three youths who
knew Michael Needham, is dead, ac
cording to confessions of Claire and
Fred Cole, 19-year-old (twins, who with
o. ivu. o.-- s,James Kendall, are in jail for the mur
ast night stole $10000 worth of gdsSderofXeedham nearf SanFrandsco
1
from the Selix Clothing company. They
rented a room in the hotel above the
store and cut a hole in the ceiling to
get into the store. -
In addition to the information con
tained in the above telegrams some sup
plemental details were received by the
governor indicating that the la1or
troubles which have encompassed . both
the Tonopah and Divide camps for the
past three months have leen amicably
straightened out and the miners and all
other classes of workers who have been
at work , for some time have effected a
permanent basis for future operations.
The terms as agreed upon by the oper
ators and miners are the temporary al
lowance of a 50 cent bonus, a compro
mise ofthe $1 demand, and the institu
tion o commisaries. These terms are
to extend for a period of sixty days, af
ter which a survey of the benefits of the
commisary will be made by a Federal
mediator and the bonus continued or
discontinued on his report.
In commenting on the settlement of
the strike Governor Boyle stated today
that too much credit cannot be given
Mr. Lord for his work in bringing the
Tonopah troubles to an end. He has
worked day and night to accomplish
this end and in his efforts and fair deal
ing he has gained prestige with both
sides to the controversy.
In this connection it might not prove
amiss also to compliment Governor
Boyle for his endeavors in the settle
ment of the strike. Had ,it not been for
the steps he took early in the wrangle
interminable strife and bloodshed might
have resulted. His efforts likewise re
sulted in the severance from the I. W.
W. of the conservatives and their or
ganization into the Tonopah and Divide
Miners union and in the complete tie-up
o the I. W. W. by court proceedings. .
After Coolie Sentiment
IBy United Press
SACRAMENTO, Nov. 8. Secretary
of State Jordan is complting his plans
for a trip next week to include Califor
nia, Oregon and Washington to sound
out the sentiment regarding the plan to
admit Chinese coolie labor to work on
farms.
last week.
, Labor Will Oppose Plan
Bt United Press
SAN FRANCISCO. Nov. 8. Offi
cials of the State Federation of Labor
have announced they will vigorously
oppose - Jordan's plan for importing
coolies. . ..
Had Loaded Scales
By United"" Pressl
SACRAMENTO, Nov. 8. The state i
superintendent of weights and meas
ures has announced a plan to counties
and municipalities to do away with
fraud in the sale of cattle and produce.
He claims he has discovered several
""loaded"" scales among California ranch
ers and farmers.
Bil Rsiliiiii
lifeFnteW
Fear Expressed Treaty Ratification
Not Attainable
iT I nited rre8l I luamtimi lnntail
tuieutxTTriM vr o ti. . I . i.vtn.w
YV Vv?-l.lAi. VX iyn, mw. o. A lie BCU- I
ate today is considering reservations to I l""Br United Press
the peace treaty penr-itting the United) VTASh'INGTON, Not. 8, S p. m, -States
to withdraw from the league of j Tie sEat this alterrcca adopted the
rations at the discretion of congress, j 6econI reservation to the- peac treaty,
Even though the resolution and ratifica-! j.., United gutM mpv
tion of the treaty with reservations Will ... . .
. . , , . v; tauraw frcra the leaeae of nations
ty? agreed to by the majority vote cf a .
c jmmitt'e of the whole it will probably HI-"" .such decision by congress. -The
rot attain the necessary two-thirds vote, reservation carried 50 againat 35,
in In for
Mis of If
Suspected They Carried Arms to
the Sinn Feiners
By United Press
DUBLIN, Nov. a Irish agents are
employed to search American steamers
arriving at Irish ports for possible ship
ments of arms and ammunition. The
United States Shipping Board's steam
er Lake Fontaina, the New Orleans, and
the Lake Franconia have been searched, ,
but no evidence was obtained that the
vessels carried arms and supplies to the
Sinn Feiners. Instructions from Lon
don were given as authority for the
raids.
er Lake rontama, trie iNew vjrieans, ana j raics.
Lflilii Has flew Lord Hmr
Members Planned to Start Demon
strations Today
Opposed to All ""Cheap"" Labor
SPOKANE, Nov. 8. Former Vice-
Severe Earthquakes In Italy
By United Press
ROME, Nov. 8. Severe earthquakes
have been reorted from the upper val- j
ley of the Tiber river. Rome is anxious
ly awaiting further reports. Heavy
casualties are feared. Meager dispatches
from Arezzo state that two distinct
shocks were felt. More than 150 houses
have collapsed and the inhabitants are
camping in the streets. -
s
ome
Observations
By United Press
WASHINGTON, Nov. 8. It has
been announced that federal agents
have frustrated a nation-wide revolution
ary plot in tlae United States. It is said
that an uprising was planned to start
with general demonstrations today and
was averted through a series of raids
made by the department of justice oper
atives in nearly a score of cities. Near
ly 600 men and women have been ar
rested. A government off icial said the
revolutionary movement was in charge
of a union of Russian workers ""more
radical than the BolshevikL"" They or
ganized in Petrograd an4 it is reported
they have 7,000 members in this coun
try ready to establish a new government
as soon as the L'nited States govern
ment was destroyed. Government offi
cials said that quantities of arms were
seized in the raids. They regarded it
as significant that most of the prisoners
were Russians.
a good city, for a lecture or educational
entertainments. A noted lecturer from
Boston advertised a free lecture at the
any political line-up that includes La
Follette and accepts the aid of the sen
lator from Missouri? The truth, is that
By Alphabet
i tended. However, Carson Citv is to
1 used for years suddenly becomes whenjhave another chance to gct on the win
opera house and thirty-four persons at- j there is no politics in the fight against
the league of nations, it is purely a
.To make progress is often difficult.'
Everybody is always willing that every
body else shall make sacrifices and be
progressive for the good of the com
munity but some are very backward in
' coming forward when it is their turn to
be progressive. Carson' City is trying
to improve, to keep up with the spirit
of the times and be a place worth liv
ing in, but the pace set seems to be too
swift for some of our slow-going breth
ren and we find stumbling blocks
. wheeled into the path of progress daily.
The proposed new court house and mem
orial building are being held up by a
few men quibbling over $2,000. Better
liave a ""Charity Drive"" and raise the
money, speed up the bujlding program
and then hire some noted writer to com
pose suitable epitaphs for a few of our
living dead. ""
And the immediate construction of a
concrete highway to Lakeview is of
fered if the necessary rights of way can
.. lie had. , it is simply amazing howvval-
public improvement Two ter Chautauqua circuit and we will see
ered rights of way for the .v,, unn a..m.w dtt, LtV, KtU
guerilla warfare against President Wil
son, at the expense of the people, who
deserve legislation that will bring peace
and prosperity instead of hunger, strikes
needed tor a
men nave orrerea ngnts or way ior tne i,annPr.a rwPmW 4th F,th fh
cost of fifing, papers, etc: A splendid ex- gth and 9th will be Chautauqua dates for
ampie. mere are some wno cannot ar-,Carscm City, with a splendid program, and strife.
ford to give the right Of Way, and SOme Of rn,,rv . ran m to Rnr. anH bear
who will be injured, ""more than others, j but how al)mrt getting up a litt!e Has the membership committee ot the
but there is no reason to believe that thusiasm at home' ' """" ' t Greater, Carson Club called on you. Are
unused land between Carson City and
Lakeview will not be more valuable
with a straight concrete county high
way than without, and that fact should
be considered by the property owners.
-' ..."" . .
Nothing advertises a town better than
to have the people attend puliltc gather
ings of all kinds. Engage a lecturer in
conversation when he is not ,busy and
There is one thing that ought to make
all old hide-bound partisan Republicans
and Democrats do a little thinking, es
pecially the true Americans. It is safe
to say that during the war nothing but
the fact that they -were United States
senators saved Bob LaFollette and Sen
ator Reed from being jailed for their
pro-German utterances.. It was not
speak of the various towns and cities J their fault that Germany was not allow
where he has lectured, and the moment j ed to crush Belgium and France, and it
By United Press
LONDON, Nov. 8. Sir Edward Ern
est Cooper today was installed lord
mayor of London with the civic pomp
musician, being chairman of the com
mittee of the Royal Academy of Music
The salary' of the lord mayor for his
year of office is $50,000, but he general-
and ceremony which has been handed hs to spend about five or si ttmes
down from the middle ages. Once more j th'- amount. Cooper's predecessor, Sir
that hoary anachronism, the ""Lord ! Horace Marshall, probably hr.d to spend
Mayor's. Show"" dislocated the normally
badly congested traffic of the city for
some four hours, but as usual London
ers turned out in huge crowds for the
annual pageant. '
The Saturday half-holiday increased
the normal crowds if anvthinsr. and
there was extra jollification over it's be
ing the first ""Show"" since the armis
tice. .
The ""Show"" contained few ntw feat
ures, being comprised .of the usual de
tachments of London volunteer regi
ments, but this year there was a notable
display of war ribbons among the
marchers, and the cannon turned out
by the City of London Royal Field Ar
tillery were atnene those which little
half a million dollars during the past
year owing to peace celebrations.
SHOULD HEAD THE PARADE
The Appeal has one suggestion to
make in regard to the formation of the
parade on Armistice Day.
Mrs. Emmit D. Boyle and. Mrs.
Maurice J. Sullivan -in an auto should
head the parade.
In the dark days of the war, when its
end appeared months off and it wis nec
essary through celebrations and par
ades to increase the sentiment and en
thusiasm of the populace it was they
who were always at the front in. the
demonstrations. No matter what the
duty those ladies were -chcre. They
more than a year ago had been thunder- ' were tnc first l serre and the last to
ing at the gates of Jerusalem. The ! lu,t-
crowds lining the sidewalks gave thesel opportunity now offers itself tc-
veterans a Vociferous welcome andih-n01 t,iem fur lheir valiant and ctaije
there was much civic pride displayed 3 ork.
over the banners borne by other citizen
you a member of the club? Are you
doing anything to improve your home
and home town ? Are you encouraging
those who are doing something? Are
you a ""has been,"" an ""is it"" or a ""com
er?"" If you belong to the ""has been""
class this is a good time to arrange to
deserve a new rating.
battalions, banners now inscribed with
the names of many a field in France,
Belgium, Italy, Salonika, Palestine and
Mesopotamia. ,.
Triumphial cars and detachments of;
Boy Scouts, Land Girls, munition and
hospital workers and many military
bands completed a picturesque parade
SENTENCE FEDERAL F2IS0NEKS
you mention one where he had a large
audience, he will say, ""Yes, that is a Lin a position where we would have had
live town, full of pep, I had a great
house the night I was there."" The en
tertainer who faces a large audience al
ways boosts the town, and always
knocks' the places where people failed
uable land that has-been idle and un- Uo attend. Carson City has never betn
was not their fault that we were not put
prolonged war with a victorious Ger-
John F. Kunz, attorney of Reno and
state Democratic chairman, was an ar
rival on the morning train to attend to
legal matters in the Federal court, f
Mr. and Mrs.' W. J. Hunting left by
man empire. And now they are leading auto yesterday for Yerington, where the
the fight in the United States senate j former Was. scheduled to address a joint
against the ratification of the treaty and , meeting of the Parents' and Teachers'
the league of nations. How can Lodge
and Penrose and Hirani Johnson justify
association and Woman' club of that
city last evening. . .
from Guild Hall, the procession wound
through the narrow streets of the city,
to the High Courts of Justice on the
In the Federal court this morning
Charles Hoy, convicted a few days ago
of shipping booze from California into
Nevada in violation cf the prohibition
statutes, was sentenced by Judge Far
rli.gton to serve a term of four months
in rh Wmlinc rnimlv Jail anil nsv
stretching over two miles. Starting , v v, tw.
torney, made a plea for extenuation for
his client. s
Strand, where Lord Chief Justice Earle Masoiu who w convicted o stlVm5
Readmg, and the other judges were ym shee tQ Indians WflS ntenced to
watting to administer the oath of office twenty momhs. imprisonment at Mc
to the new chief magistrate, who drove Neils Island and to a fine o(
m his magnificent state coach, attended D0
by quaintly robed officials, and escort- i Sheriff Joe Harris of Elko county, af
ed by a squadron of Hussars. j ter arriving on the morning train, turn-
Tonight there will be the customary ; ing a couple of prisoners over to the
civic banquet at the Mansion House, at prison authorities and jhen hobnobbing
which Premier Lloyd George and other for a brief while with many old friend),
leading statesmen will speak. i left by auto for Reno. The sheriff is
Sir Edward Cooper is a. well-known always a welcome visitor in Carson.
x",Carson City daily appeal. [volume]
