city,state,date,lCCN,text,title
['Seattle'],['Washington'],19100701,sn84025811,"FRIDAY July 1 1910
From the Seattle Star it was learned that the fight
in Spokane was between Wilson and Poindexter. On
Friday evening the same authority declared the recent
primaries in Spokane had broken even with Wilson
and that no drastic ""stand pat"" resolutions would be
passed. The next day, however, the Spokane county
convention was held and the Poindexter men
went to defeat before the all - conquering
Wilson forces by something like two to
one and since that time the Star has had nothing to
say about Poindexter's chances in Spokane, nor has
the Times had anything to say about Burkes chances
of carrying Spokane county. The tact of the whole
business is, John L. Wilson hae swept Spokane county
and thereby drawn first blood in the battle of ballots
that will be pulled off in September. Thomas Burke
will not carry a county in Eastern Washington;
Thomas Burke will not carry a single county in the
state of Washington; Thomas Burke will not get
enough votes to know that, he also ran.
Every vote that Thomas Burke gets in the coming
primary election, based on the expenses of his cam
paign, will have cost him in the neighborhood of twen
ty dollars each. Levy Ankeny's vote two years ago
will be like the hosts of Satan incomparison. If King
county desires to do herself proud she will go to
Thomas Burke and say to him, ""Get thee behind me,
Satan."" Miles Poindexter is a hundred times more
formidable foe to Wilson than Burke and it looks as if
Wilson will beat Poindexter in every county in the
southwest and take from him all the larger counties
in the eastern section of the state. He will beat him
in the northwest, and that too, in spite of the fact
that every Democrat in the state will vote the Repub •
lican ticket and vote for either Burke or Poindexter,
both of whom are simon pure Demoorats. The
Times is a Democratic newspaper trying to
run Republican primaries for the money it gets for
doing so; Judge Thomas Burke is a Democratic poli
tician turned Republican to get an office; jim agnew,
his manager, is a down and out political boss, which
trio of political renegades are trying to run the Repub
lican politics of the state. The Seattle Republican
is always for some Republican, but to hell with Demo
crats hiding behind a Republican garb for the sake of
an office.
""What has been said about Senator Wilson's recep
tion in the southwest, during his recent visit there,
has not been half told,"" said C. C. Dalton one day
this week, who was with him. ""I know the voters of
that section and I know when they are for a candidate
and when they are not. I have lived there and I have
campaigned there. The southwest is for John L.
Wilson and I believe he will get a majority over all
down there, The banquet as Aberdeen was simply
killing and it was more in the shape of an elecction
ratification than a compaign gathering The meeting
at Hoquim was a surging mass of humanity and every
inch of space in the opera house was taken and almost
as many more were on the outside. Senator Wilson's
speech to that vast audience was a masterly address,
the echoes of which are being heard all over the state.
I say unto you without exaggeration no other candidate
in the history of the state ever received a more en
thusiastic as well as flattering reception in the south
west than did the Hon. John L. Wilson on his redent
tour of that locality. The papers are for him and all
factions of the Republican politicians, and even Archer,
of Aberdeen, is not so pronounced as was he a few
weeks ago.""
Bearing out Mr. Dalton's statement about the news
papers the following from the Aberdeen Herald an old
line Democratic organ will give you some idea of how
the Republican papers stand down there:
With true newspaper instinct, John L. Wilson, pro
• prietor of the Seattle P.-l, and candidate for United
States senator, is a believer of newspaper publicity,
and, if his idea be correct, he has the other candidates
faded to a frazzle in the southwest. At the banquet
in this city Thursday night the Aberdeen World, the
Aberdeen Tribune and Hoquim Washingtonian capitu
lated, and pronounced for Wilson, while the Grays
Harbor Post admitted it was ""open to conviction.""
As far as heard from, Wilson has, in addition to his
own paper, the support of those named and one in
Centralia, one in Chehalis, one in Bellingham and one
in North Yakima, besides a number in the smaller
towns, while Burke appears to have but one in Seattle,
one in Spokane and one in Walla Walla. Poindexter
has the largest newspaper support of any of the can
didates among the country weeklies, besides the three
leading papers in Spokane his home city, one in Seat
tle and one in Tacoma.
It would perhaps be unfair to suggest mercenary
motives to some of those papers, but we submit with
all candor, the time, the place and the candidate were
POLTICS AND THE POLITICIANS
not judicially selected for the Wilsonian conversions
on Gray Harbor, if the support of those papers was to
be accepted as patriotic—not commercial.
The candidacy of Gen. Ashton, supported by the
Perkins Tacoma press, is not taken seriously outside
of Pierce county, if there, It is generally regarded as
a shrewd Wilsonian movement to endeavor to head
off the Poindexter vote in that county, by appealing
to local pride in a section where he could hope for but
light support. In fact the candidacy of Ashton is
sized up with the other jokes—Humphries and Free
man—except in his case there is Wilson to be served,
while t c others are but cases of exaggerated ego.
The attitude taken by three papers on Grays Har
bor in the senatorial contest places this section in a
bad box as regards securing what it most of ail needs
—a congressman.
Speaking of a congressman, the most amusing, or
amazing, thing so far in this campaign is the attitude
of the Aberdeen World, in declaring for Wilson on
Thursday night, ar d nominating Hon. Alex Poison for
congress in the issue of the next day. Here was a
case of refreshing innocence. No one keeps track of
the trend of political events, outside of the World of
fice, is ignornant of the fact that John L. Wilson and
Walter W. McCredie have formed an alliance, offen
sive and defensive for the purpose of seating them
selves in the upper and lower houses of Congress.
Why, the formation of Wilson-McCredie clubs are now
going on all over the second congressional district,
a strong one being launched at Centralia the day be
fore the Aberdeen Wilsonian banquet. The Herald
ventures the assertion that the newspaper that at
tempts to support Wilson and oppose McCredie will
quickly find itself in an impossible position, in which
its influence for either will be represented by 0.
This paper has always advocated the sinking of all
political differences in favor of a congressman from
Grays' Harbor, believing that a proper man in con
gress would hasten the day by many years when this
will be one of the first-class harbors on the Pacific,
and would be pleased to support Mr. Poison or any
other honest, capable man with that view. But for
many years, peanut politics and lust for petty office
have controlled the dominant party in Chehalis county
with the natural result, that in national politics it has
heen an insignificant pawn in the game. The machine
this year being divided between Burke and Wilson,
may change this condition to some extent, but no per
manent plteration may be looke i for until the average
voter is educated out of permitting tin horn politicians
to deal in his vote and trade in his prejudices in na
tional affairs while they skin him at home.
JOHN L. WILSON AND COOLIE LABOR.
When the Seattle Daily Times says ""There was no Re
publican convention in 1888 in the territory now State
of Washington it either wilfully prevaricated or the
writer was grossly ignorant and too indolent to look
up the facts. In 1888 the Republicans of the territory of
Washington held a convention at Ellensburg and at that
convention the Hon. John B. Allen was nominated for
delegate to Congress. In that convention was the well
known politician, J. 0. Ilaines. who was the only delegate
from King county that voted for Mr. Allen, the others
voting for Thomas Jefferson Humes. That was the last
territorial convention. Of course the Hon. John L.
Wilson met the Hon. John H. MeGraw there because Mr.
Wilson led the Spokane delegation, which went to the
convention more or less pledged to the Hon. George
Turner for delegate, but seeing that Allen would be
Dominated swung to Allen while Mr. MeGraw was among
the leaders of the King county delegation that voted
first and last for Tom Humes, with the exceptions of
Mr. Haines, who, as stated above, voted for Mr. Allen.
Of course the Times will pay no attention to such a mis
take as that, for it always manages to misstate things
with the- view of them having as much effect as they
may on those who do not know the facts.
Speaking about the attitude of the Hon. John L. Wil
son on the Chinese and Japanese emigration to the United
States the following extract taken from a speech made
by him in Congress October 16th, 1893, will give the
voters in this, state, avlio are much agitated over this
question at the present time, some idea of what they may
expect of Senator Wilson if he is returned to the senate
at the coming election:
""Mr. Speaker, the question of emigration is a grave
and important one. and especially that portion which
relates to Coolie labor. Had the Chinese emigrated to
the eastern shores of this country instead of its western,
it is my judgment they would have produced a revolu
tion long since, because you cannot place in any portion
of this country a hundred thousand laborers who make
their purchases from their own country, and what money
they have left from every dollar they earn is sent to their
THE SEATTLE REPUBLICAN
• # *
own country for an accumulation that they can return
upon. And it has only been on account of the unexcep
tional conditions of the Pacific coast that we have been
enabled to stand this drain for twenty years. And so I
say this question is a grave one. We have to the east of
us 300,000,000 of discontented people and to the west of
us 400,000,000 of uneducated and unchristian races.
'""Upon this our native land meet these two great
streams, the one white and the other yellow, and it has
been said by someone 'they cannot flow peacefully upon
parallel lines, but as the translucent waters of the Miss
issippi and the yellow tiood of the Missouri mingle, the
greater and clearer stream is stained and flows polluted
to the sea.: Let us then perform our duty without re
gard to politics, with courage and with conscience in
defense of the honest labor of this country. Let us do
justice, and under no circumstances forget our duty and
our obligations to our native land."" (Applause.) —Con-
gressional Record—House, pages 2560, 2561.
He also said in this speech: ""The people are intensely
interested in this (Chinese) question, and, sir, they are
interested in it without regard to party, for it is a
battle of the white man against the Asiatic, of the Amer
ican labor against the worse than pauper labor of Asia.""
Further on he said, ""It is a battle that we are making
for the labor of our section of the country; it is a con
test between the cheap labor of the Orient and the more
cultivated and civilized labor of the Anglo-Saxon. In
the same speech speaking about emigration he said: ""The
importation of convict, coolie or other labor of that char
acter is an unmitigated evil.""
""Speaking about that Burke club list, it is so spur
ious,"" said a welt-known Seattleite, ""that you can safely
say that if it were made triplets of it would not be far
out of the way. I really do not believe, that there are
over 5,000 bonifide voters on that list that will stand
for Burke in the primaries, and those men did not sign
the paper with the intention of being a member of a
Burke club. Republicans hesitate before going on rec
ord to support a Democrat for the highest office in the
gift of the voters of the state.""
There may be some Insurgent spirit among the voters
of Seattle, but it is so slight that it is hard to find it.
The voters of King county are for either Wilson or
Burke. Outside of King county the Burke sentiment
is just as slight as is the Insurgent spirit in Seattle.
The voters and business men of Seattle, who want a
United States senator, can figure it out for themselves.
In Seattle, the race is between Wilson and Burke; out
side of Seattle, the race is between Wilson and Poin
dexter. Wilson will come to the county line with suffi
cient votes for the vote of the county to overwhelmingly
nominate him. Burke will leave the county with not
half enough votes to nominate and will get practically
no more. Now, Mr. Seattle Spirit, in your opinion,
which of these two senatorial aspirants is it your duty
to support? jil
Representative Ed. Bradsberry of Sedro-Woolley,
who was in Seattle one day this week, does not think it
probable that Burke will cut much figure in Skagit.
Henrjr Mcßride, to the contrary notwithstanding. ""In
my opinion,"" said he, ""Senator Wilson will get as many
votes as all of the other senatorial aspirants in Skagit
county. Talk is cheap.- but getting the votes is quite
another thing. Skagit county has always been for Mc-
Bride, when Mcßride was for himself, but now that he
has shifted his position ami is fighting for the men that
have always fought him. it's time for the Skagit county
voters to do a little shifting fur themselves, and in my
opinion they will come pretty nearly doing it.""
""You say tin- souihwesi is in good shape for John L.
Wilson.' Well, in my opinion it is utterly impossible
for the southwest to be in one-half as good shape for
Senator Wilson as is the northwest. Rlark Iliis predic
tion: the northwest will give Senator Wilson a majority
over all, and if that is not u'oinii- some, then excuse me,""
came from a prominent politician of Snohomish county
one day this week.
.
»",The Seattle Republican. [volume]
['Corvallis'],['Oregon'],19041004,sn93051660,"r r
-4 - ' V
sue
jM Iiu JJ lli jDj
4 si.
Vol. XLI.
Corvallis. Benton Cijnty, Oregon, Tuesday, October 4, 190L
JXo, SI
KOTLY CONTESTED GAME
O. A. C. Wins Against Alumni in
Score of I 1-0.
The first football game in the
series laid out for the season by
the' OAC Athletic Association
wail ' played on the local field.
Saturday between the OAC team
of this year and the famous cham
pion OAC team of '97.
The game was hotly contested
from start to finish and it was
plainly evident that the the old
boys had not forgotten how to
play although they had been
separated for seven years. They
were both old and tricky and all
things considered they played a
remarkably good game. Of
course, under the circumstances,
it was too much to expect that the
alumnal team should put up even
a scoreless game, they soon be
came sore and quickly lost inter
est. The OAC team being sea
soned veterans had a decided ad
vantage but yet the score at the
end of the game was the result of
hard fighting. End runs were
not used to any great extent,
nearly the entire game consisting
of line bucking, which kept both
teams in a constant state of ex
haustion. OAC lost the ball
twice on fumbles and an offside
play cost her a touchdown.
The alumni came in for a fair
share of errors but all things con
sidered, errors on both sides were
remarkably few. Individual
playing was prominent through-
out the game, indeed, had it not
been for the work of individual
players at two or three . critical
points in the game, .the score
very likely would have , been
nothing for OAC. Those who
distinguished themselves were
Pilkington, Root and Williams
for OAC; Gault, McBride, Thurs
ton, Scroggins and Edwards for
the alumni.
he line-up was as follows:
Gault's place as full back on
alumnal team and 1 Hnddleson
and others go in.
Alumni get ball and kick off,
ball down eaOAC's 45-yard line.
OAC advances ball 10 yards, lose
ball on tumble. Alumni buck
bard twice with no gain, punt
for ' gain 20 yards. Root ad
vances ball 8 yards in a series of
hard bucks, Pilkington forces
ball forward 25 yards and OAC
loses ball on downs. Alumni
buck hard but lose on downs.
OAC by hard fighting advance
ball to within 3 yards of alumni's
goal and lose on fumble. Alumni
punts 20 yards. Both teams
work hard, with OAC advancing
steadily toward goal. Williams
gets ball and makes right end
run 18 yards, touch down, Pil
kington kicks goal.
Teams line up with several
changes of men on alumnal team.
1 Teams stav near center of field
until close of second half of game,
score iio in favor of OAC.
The famous old champions
were exhausted and glad to quit.
It was an honorable and glorious
defeat and they would not have
been satisfied had it been other
wise. It was larcelv a matter of
sentiment with most of the team.
They were, with one exception
all together again, and they
talked over old times, had their
pictures taken and almost forgot
what they had come for. A ban
quet in their honor was served in
the Armory in the evening in
which all took part and which
will remain as one of the bright
est spot in their lives.
Far-East Fables.
Cattle Values.
Alumni
C Hamilton, Hall
BG Elaia
LG Bodine s
RT Walters -
LT Gyp Thurston
BE McBride
LE Buxton
RH Scroggins
LH Holgate
QB Edwards
FB Gault,
Hnddleson, Osburn,
mpire, Frol.
Walker
Bandy
Danlap
Abraham
Bower
Rinehart
Cooper,
Boot
Williams
Bote
Pilkington
Subs, Oberer,
Nash.
v.r.nA v.. it. Rrvflon : mn
Havward : timekeeper, Prof. Cordley.
The came was called at 3:30
p. m. and was divided into 15
and TO minute halves. Alumni
lost ball on toss also got north
side of field with sun shining iu
their faces.
OAC kicks off, ball down on
virvvard line, bv a series of bucks.
in which Gault , distinguishes
himself, alumni advance ball to
renter ot field, both teams rest
one minute, alumni lose in next
two downs and Gault punts ball
to OAC 40-yard line. OAC
hnrks hard and fierce, makes
pain in first downs loses ball on
downs next series.
At the end of first 5 minutes
neither side has made any ma
terial gain, both teams resting
near center of field. Alumni
lose ball on downs. Scroggins,
tackling is superb, McBride gets
his man every time. UAt lesees
ball on offside play, alumni buck
twice with no gain, punt to OAC
. i 1? T-:H""
40-yard line. ruunwu wcu
advances ban 15 yams in a mag
nificent charge, Rose takes bal
in next nlav for co-yard run
declared offside play. Alurani
cunts. OAC punts,: 'Alumni
pants, OAC punts, Alumni try
bucking again, hammer OAC's
line bird for five downs then
kick again, Root for OAC takes
ball and in a magnificent sprint
snakes touch down, goal kick
lost Alumni take south' side
of field and kick off. play two
minutes and end first half of the
nme -o in favor of OAC.
In the second half Steiwer sub
stitutes Cooper on lett end,"" Little
takes Bundv's place as right
From a letter by Dr. Withy-
combe, of the Agricultural Col
lege published in last Friday's
Oregonian, we make the follow
in& excerpt
o . . ..
It is difficult to explain me
nresent slump in cattle values.
There are Derhaps fewer cattle in
:- . ...
proportion to our population to
day than there have been tor tne
past half century. Good cattle
will certainly command high
Drices in the near future: hence
there is nothing in sight to even
suggest panicky conditions.
Stock feed of all classes will
doubtless be high this winter,
conseauentlv the farmers should
eed with ludgment. remaps
the greatest mistake made by
owners of cattle is the withhold
ing of supplementary feed unti
late in the season. Calves and
yearlings which are thin should
receive a small ration ot hay or
grain early in the winter so as to
obviate extreme emaciation. The
high price of mill feed will proba-
blv have a discouraging eitect on
-w ""
dairying, but good cows proper
ly handled will alwavs make a
good showing on the right side
of the ledger. It is a good busi
ness policy for dairymen to con
sult the records ot their cows,
and every matured cow in the
herd which has not received good
dairy care that cannot show a
yield of 5000 pounds of milk and
200 pounds ot butter tat in ten
months ought to be consigned to
the shambles ot the butcher.
This may prove to be a severe
weeding-out , process, , but it is
better to maintain a few good
cows than a lot ot inferior ones.
There can be no question of
the sound sense which recognizes
that a few good cows are of
greater profit to the dairyman
than a larger herd of inferior ani
mals.
A hunting party of Christian
Nations being out In search of
game, descried a Chinet Coolie
sitting at rest under a Cinnamon
Tree in the depths of the forest
regaling himself upon a frugal
lunch of Chop Suey, his well
laden ''Baskets disposed in the
path before him.
""Jvet us,"" whispered the leao
ing Christian Nation, ""advance
stealthily, fall upon this friend
ess Chink, and Partition the
contents of his Baskets among
us.""
The proposal was received
with enthusiasm, and the Grand
March of Civilization toward the
Coolie and his Baskets began.
'The stuff of this Heathen,
who's a child of Satan, is already
as good as Ours,"" murmured the
Nations. ""The fool hasn't learn
ed to Pack a Gun.""
Suddenly from the woods be
hind the Defenseless Coolie step
ped a Jap carrying two Mauser
Rifles. One he gave to the China
man, and the other he retained,
and both Mongolians Cocked
their Weapons.
The Nations, surprised and
iustlv Indignant, hastily retreated
On reaching a distant place ot
safety they held a meeting, or
ganized a Mutual Protective
Association, named it ""The Con
cert of the Powers,"" adopted
strong Resolutions warning Chris
tendom that a New Terror had
arisen, which threatened the
beneficent progress of True Re
ligion and the Best Civilization.
This New Terror they described
as the yeuxw peril, and be
sought all good Christians to
pray and Arm against it tor their
protection.
Moral: Nations as well as car
porters may sometimes wake up
the wrong passenger. Arthur
McBwen in S. F. Examiner.
ffpll ""I LIl'S 1TSM F
, V-' . ' "" ' ' y.jk$ ! '
. laa T B.KuppeheiaMjpp, '
Copyright, 1901. by B. KUPFBMHBIHBB CO.
A narrow escape from being
killed, was the introduction an
Eastern gentleman received in
CWvallis. Thursday night. In
comoanv with a local real estate
dealer, the stranger was looking
at a piece of land near the bam
Moore residence, when something
struck the barn above his head.
It was a bullet from a 22 target
rifle, with which some boys were
practicing a short distance away.
It penetrated an inch board and
would have Killed the stranger,
had it struck him in a vital spot.
Bv a very careful calculation the
direction from which the bullet
came was ascertained and the
nerrjetrator of the deed is known
Neighbors say the reckless use of
firearms has been going on ior
some tfene and it must be stop
ped or severe measures will be
taken to suppress it. It is not
one nerson in oarticnlar but
several, and as public safety is at
stake, it is necessary to do some
thing before the practice goes too
far.
Are Not as Satisfactory as
T0dsmQ(sI17(SQ
But when you have seen the picture
you'll want to see the clothes too.
You won't be disappointed in the
Zuppcnheimer
Guaranteed clothing. Better than ever
this season. See the new fall styles in
our north window.
CORVALLIS. P"" I MM I PR OREGON.
Let Us Tell You
all about our large stock of furniture,
carpets, wall paper, stoves etc. We are
headquarters for everything: in the line
Of
House Furnishings.
This store ia the scene of bustle and
activity every week day from 7 a. m. to
6 p. m. Oar prices are always reason
able. Bedroom suits from $13.50 to
140.00 and other things in proportion.
THE HOUSE
FURNISHERS.
Cady
CORVALLIS,
OREGON.
1900 Washer
Best, strongest, most durable. Better
lnnfc at one. we are the sole aeents fat
them in Benton county. They are easy
to operate, perfectly balanced, built of j
the best material, lasts longer, gives
more comfort and satisfaction than any
other waBher. This is saying a good
deal but we can prove it.
Grove's Tasteless Chill Tonic
hes stood the test 25 yesrs. Average Annual Sales ov&Ora end aHalf Mffljos
A wire is beiaz put in between
the Independent telephone com-
Danvs central station and the
fire alarm bell in the tower of
the Citv Hall. It is tor the pur-
pose ot facilitating me ocparx-
ment in receiving nre alarms
and ia the invention of T. K.
Berry. Central"" by the means
of a lever will be abi to ring
the fire bell londlv enoneh to
awaken those nearby. When
ever a fire loccars. anyone having
-mm
a'phoneoan nng up ""central""
c
lipHi's lestinit
FOR SALE.
. .
it seffl iTtthin TW
A Bosom to the Right Mian !
Special attention paid to Ladies Garments,
nd special rates to Students.
JACK and
UP-TO-DATE
CLEANING,
REPAIRING AND
DYEING.
BOB. 1
oftskDMifcafBUTM? or
BCftRV'S- BICVCLE-SMOR.
ADAMS BROS.,
-' Will furnish estimates on anything in the bwkHngJline.
All ' f rcet d novea fence to order. -Soiitli Main St., CorviSSD
ffuard for OAC. Hall takes
to cmrn m up aiaim.
I",Corvallis gazette. [volume]
