city,state,date,lCCN,text,title
['Honolulu'],['Hawaii'],18971123,sn85047084,"4
THE PACIFIC COMMERCIAL ADVERTISER : HONOLULU, NOVEMBER 23 , 1897.
111R PACIFIC
W. N ARMSTRONG. - EDITOR.
TUESDAY
NOVEMBER 23.
THE JAPANESE SITUATION"".
Owing to our intiinaU' illations
with Japan and the fact that our
prosperity is now dependant on
Japanese subjects, and another
fact, that we are calling fu more
of them every day, it is supremely
important that we should under
stand, if it is possible to do so, the
general course of political
thought -and action in that coun
try. We are now involved in one
rather serious dispute with the
Japanese and it is evident enough
that there will be a good deal
more friction in the future, with
or without annexation.
The resignation of Count
Okuma from the otlice of Foreign
Affairs in Japan was expected. It
appears to be due to the action of
the Progressionist's party of
which Count Okuma is the leader.
That party demanded at tirst a
great increase in the military and
naval strength of Japan, and its
pronounced foreign policy was
the closing out ot ine territorial
jurisdiction of foreign powers in
the Empire. At no time was the
acquisition of territory beyond
the sea advocated by that party
III lilt? I-Jlv. L Ul UUl Ul 11. XMK, l""
yearly maintenance of these great
armaments has already caused a
delict of over $20,000,000 and the
Progressionists, afraid of heir
own policy, now demand great re
forms and economies in the ad
ministration by the Cabinet and
. it declares that its promises have
not been kept. Count Okuma, as
the leader of that party, had been
taken into the Cabinet in order to
keep the party quiet. He is not a
Satsuma Inan, and as the Oo
ernment is in the hands of the
Satsuma clan, he was not in much
1. -w-w J 11 ""I
favor. with it. lie sougnt tne aiu
of Count Ito who is in sympathy
with the Liberals, but he got no
aid. He was then forced to aban
don his own party or resign. He
resigned. The jingoes here have
it in their heads that the Hawai
ian matter had something to do
with it. It had about as much to
do with it as it had to do with the
late Presidential contest between
Dry an and McKinley.
In neither the vernacular or the
foreign Press of Japan is the Ha
waiian matter mentioned. The
Japanese Mail gives eight
columns to the discussion of the
situation, and the Kobe Chroni
cle several colums. Xo allusion
is made to the Hawaiian affair.
The issue is stated by them to be
the alarming financial condition
of the Government, and of course,
with that is the struggle for
power between the clans.
In order to meet the alarming
deficit, there must be increased
taxation. The leaders of the
many factions are afraid to meet
that issue, because any party that
advocates it may be defeated in
the coming election. The Japan
ese peojde have had their military
and naval hula, and now don't
wish to pay for the music. This con-
Ull lull I llllio -W-l-VV H'tlf, -
fore the expulsion of immigrants
from Hawaii. When that expul
sion took place, the people acted
precisely as the "" Americans act
ed when the British demanded
Mason and Slidell in 18(52.
Though thev did not have war
ships enough to blockade the
Southern ports, and General Lee
held their armies in check within
sight of the Capitol, they wanted
to fight the British at once. There
was a frenzy for fighting. But
the Government said ""no""
and gave up the captured diplo
mats. So the Japanese people, in
n frenzv about what thev believed
was an insult given to the nation
by Hawaii, demanded extreme
measures. But the Government,
""conservatism itself, compared
vwithlthe people"" as Mr. Mclvor
stated during his visit here, said
""no"" and kept the jingoes well in
hand. j
We believe in the domination
of American civilization here.
We know also that American
prosperity here, is now, unfor
tunately, dependent upon the
Japanese, and we are quite stupid
enough to think that it is just as
well not to irritate a class of men.
on whom we are dependent, who
utnumber the Anglo-Saxons
live to one. and whose children
torn on these Islands already out
nitnber the children of Ameri
cans, h,nglisii and dermans.
However, we may not understand
the lirettv traine of iriuvhi"" with
ire. American warships may
protect this city, but they cannot
protect the cam1 fields.
voyage on the cruiser Eonnie Dundee,
notices the complete obliteration of
any . distinction between line
and staff. Indeed, such .
the perfect and concentrated organi
zation of the whole service on that
vessel, we are justified in saying that
resident Dole has finally convinced
he American naval authorities that
the distinction between line and staff
should be abolished, and therefore it
will be.
:S TDD3
(D
LINE AND STAFF.
The Navy Department in Washing
ton it is said, has finally arranged the
ong standing dispute between the
line and the staff, and will recommend
the enactment of a law adjusting pro
motion and rank. The administration
of the service has been to some ex
tent, carried on under the theory of
caste in India, where one man would
bring a dish from the kitchen to the
dining room door, but could not pass
it. Then another coolie took the dish
to the table, but could not place it be
fore a guest. Another coolie took it
and put it in. its proper place. If there
were twenty servants in attendance,
only the one with the right caste could
open the wine. If the coolie who plac
ed the dishes before the guests had a
fit, the guests had to wait until an
other person of the right caste might
be found in the vicinity, before they
were served. It is claimed that this
caste theory prevailed in the Navy, be
tween the line and staff.
As this important reformation has
taken place, only since the present
squadron under Admiral Miller arriv
ed here, it would be only justice to say
that the admirable management of our
own navy or ""cruisers"" has not escap
ed Admiral Miller's attention, and his
report on the subject has stimulated
the Navy Department in Washington
to recommend the Hawaiian , system
Anyone who is betrayed into taking a
People who pay for seats at the
theatre have the right to be indignant
when women wear high hats and ob
struct their view. A cynical theatre
goer in one of the large cities said:
'The woman with the high hat is in
a bad way. She knows that she ob
structs the view of those behind her.
She knows that the woman in front ot
her obstructs her view with a high
hat. Wrhat should she do? She cams
to see the. play and also to be seen.
She may be seen, but she cannot see.
and is like the donkey between two
bundles of hay."" A Western manager-
tried to cure the evil by hanging up a
placard near the door: ""All ladies who
are not bald headed will please remove
hats."" He became a martyr to the
cause. io doubt it is inconvenient to
remove hats, but that is no excuse for
selfishness. In places, where the thea
tre or the opera is a part of the daily
ife of the people, the wearing of hats
regulates itself, and women would as
quickly raise umbrellas to obscure the
view of those seated behind then, as
they would to wear high hats.
AUCTION SALE
OP
HOUSEHOLD
FURNITURE
ON WEDNESDAY, DEC. i.
AT 10 O'CLOCK A. M.,
At the Premises, King street, Pa-
lama, I will at public auction, the
!1 1 YJV xl 1 J T Si
r urniuire anu naiwis ui lue iaie rru
ish Commissioner A. G. S. Hawes,
comprising complete iurnisnings as
follows:
SILK UPHOLSTERED DRAWING ROOM SET,
Ebony and Walnut Chairs,
OIL PUGS ID EilH
Lacquerd Tables, Walnuts,
LARGE K0A BEDSTEAD
: Mirror Front Wardrobe,
Mattrasses and Pillows,
EASY CHAIRS AND ROCKERS
Extra Large Black Walnut Dining
Table,
Mirrored Side Boards, China, Plated
and Glassware. Valuable collec
tions of
AFRICAN, JAPANESE AND HAWAIIAN
CURIOS AND IMPLEMENTS,
One pr. Mounted Birds of Paradise
One Large Family Carriage,
One Phaeton,
One State Carriage,
ONE SPAN GREY HORSES
Double and Single Sets Harness
Saddles, Etc., Etc.
j Without exertion, weak, weary sad de
pressed, ims 13 me pitiable condition of
thousands at this season. It is due to
impoverished blood. The vital fluid has
become loaded with impurities and de
pleted in quality. It leaves the system
Because the blood is the means nature pro
vides for supplying nerves, organs and
tissues with nourishment, and health and
vigor cannot be expected when the blood
is thin and impure. Hood's Sarsaparilla
is the remedy for this weakness, because
it enriches the blocd. It cures
The caterpillars are great eaters, the
different species consuming from five
to 20 times their own weight of food
each day.
Troubles by feeding the nerves upon
pure, rich blood. It overcomes that tired
feeling, creates an appetite and gives re
freshing sleep. If you want to feel well
you must have pure blood. You may
have pure blood and good health by taking
Hood's Sarsaparilla, which, by its un
equalled record of cures has won the first
place among medicines. Get only
K3d
Sarsaparilla
The One True Blood Purifier. All druggists. 1.
Prepared only by C. I. Hood & Co., Lowell, Mass
Nature s
Dig
If your digestion is poor, your health
most certainly will soon be impaired.
The food not being properly digested
causes the stomach to be overworked
and deranged. When this occurs the
whole system becomes effected. .
Dr. Russell's
The greatest benefactor for all de
rangements of the system is DR. RUS
SELL'S PEPSIN-CALTSAYA BIT
TERS. t
As a remedy for those suffering with
dysentary or chronic diarrhoea, its val
ue cannot be overestimated.
sin
Hood's Pills
HOBRON DRUG COMPANY,
Wholesale Agents.
DEALERS IN
Real Estate and Financial Agents,
Telechone 678. ....
3U FORT STREET, HONOLULU.
We are ready to purchase Large Estates near Honolulu an$ Hllo, and
Coffee Lands on Hawaii.
Loans placed and negotiated; Estates taken charge of and managed.
Choice Lots for sale at Kewalo, at Punahou and the growing City of Hllo
on the installment plan. Houses built for investors. No trouble to show
property to intending purchasers. '
LLISTER & CO
TIMELY TOPICS
November 20, 1897.
When You See
An article
advertised
in this col-
Pepi
It will give strength to the stomach,
invigorating to the liver, tonic to the
bowels and correct digestion.
As a tonic and builder, this valuable
remedy stands unsurpassed.
Calisaya-
The best proof of the virtue in a pre
paration is the results obtained by
taking it. The remarks from those
taking the remedy speak very highly
of it
Bitters.
Try a bottle and tone up your sys
tem, which will enable you to do your
labors with ease and comfort.
Premises open for inspection on
Tuesday, November 30, from 9 a. m.
to 4 p. m.
JAS. F. MORGAN,
4772-td AUCTIONEER.
in
SOLE AGENTS.
umn you can make up your
mind that we have tested it
beforehand, and have found
it well worthy of serious at
tention. Our business is trade, and
our trade is in that class of
goods best suited to the
country and the ideas of the
people the best.
CHEAP HARNESS is not
necessarily worthless har
ness. We are in a position to pur
chase cheaply and can there
fore give our purchasers the
benefit by selling cheaply.
We stock all descriptions
of harness, from the plain
plow harness to the elegent
buggy set, either in black or
russet leather, express wagon
harness, dump cart harness,
mule harness, etc,, etc.
An inspection of our large
stock will convince you that
we know our business, and
the prices -we have placed
upon our goods will surprise
you.
La
S
Cor. Fort & Merchant Sts. ,
HAVE JTJ8T RECEIVED A CHOICE
ASSORTMENT OF
y7o
FROM THE FaJTORIJCS OF
Intimidad,
La Espanola, ,
La Africana,
Henry Clay & Bock & Co
t ill
Mil i
286 FORT ST.
WHOOPINQ COUQH, CROUP,
ASTHMA, CATARRH, COLDS.
CRESOLENB being administered by inhalation,
gives the safest and most effectual means of treat
ing the throat and bronchial tubes. Its efficiency im
Whooping Cough anu Croup is wonderful. Its anti
septic virtues render it invaluable in contagious
diseases, as Diphtheria, Scarlet Fever, etc. Des
criptive booklet with testimonials free. Sold by
druggists. t ,
HOLLISTER DRUG CO., Henoch, H. 1., Agents.
ID
ear
Is i tie
Ifatt
""Honolulu
hawaiian islands)
CLEANSES AND PRESERVES
the Teeth and leaves them
White and Beautiful, j
CM
Hardens the
Gums and Imparts
A DELICIOUS SWEETNESS
TO THE BREATH.
Prepared Only By
Benson, Smith & Co
Mew
Suitings!
Sew
Coattags!
lew
IrowriMs!
1 u
JUST ARRIVED EX ""MIOWERA.""
We would call your attention to the fact that in case of Annexation the price of all Woolen Goods will
Incre
ase -Jus-fc One Hundrod Per
NOW is the time to make your purchasesl
"" TAKE
A TUMBLE"" Or You Will Get Badly Left !
m",The Pacific commercial advertiser. [volume]
