city,state,date,lCCN,text,title
['Washington'],['District of Columbia'],19350612,sn84026749,"’’Oil for the Lamps of China"" ♦ ♦ By Alice Tisdale Hobart
Western Life, Love Clash With
Ancient Ways of the
Far East
(This is a serialization of the Cosmopolitan production
coming to Warner Brothers' Earle, June 14J
WHAT HAS GONE BEFORE
After three years in Manchuria as a field man for an
oil company Stephen Chase, disappointed by his Amer
ican sweetheart, Lucy, marries Hester Wentworth whose
father had died on the trip to China.
They live in a lonely company hut in Manchuria.
Stephen’s duties keep him from home much of the time.
The company adopts his plan to sell cheap lamps.
Hester loses her baby at birth. They return to the
“States” when Stephen gets his vaction. Stephen is no
tified at the home office that he is to have charge of a
division.
Ho, a venerable Chinese, becomes his adviser and aids
him in understanding the psychology and customs of his
countrymen. Hester’s offer to teach one of Ho’s family
to speak English precipitates a quarrel in Ho’s household.
Stephen and Ho on a journey to the interior find evi
dence of thefts by one of the native merchants. Members
of the man’s family promise to make restitution.
In Ho’s eyes, Stephen realized, there was an implication in
his refusal to accept the ring—a hidden insult. He had ac
cused Ho of wanting to bribe him! Squeeze—he had accused
his friend of it all unaware he had stumbled into this di
lemma, and he must go farther; the ring and the silk must
not stay in his keeping, or it would mean that he had ac
cepted them by that indirect method so beloved by the
Chinese. So he took the ring and the silk and performed
the last ruthless act, thrusting them into the hands of his
friend, in order that Ho might know beyond a doubt that he
would not accept them.
Then at the moment when he
felt that their friendship was
destroyed, away out occurred to
him. The barriers of their two
ways of thought had erected
themselves so suddenly, that he
had forgotten there was a solu
tion.
An Impasse
“Ho, my friend!” he cried,
eagerly. “I can accept cigars,
cigarettes! And I will accept,
I will accept.” But Ho said
nothing; only snorted like a
great porpoise. Then he turned
and went out so hastily that the
skirt of his long gown blew out
behind him.
Stephen was unhappy, unable
to take satisfaction even in the
jade bracelet, his Christmas gift
for Hester, which he felt, a hard
substance, in his pocket. Would
the compromise he had suggest
ed save Ho’s face sufficiently to
reestablish the relationship?
Nothing, of course, could heal
the disappointment of Ho over
the ring—or his own disappoint
ment, for that matter. He would
have liked to own the ring, to
have worn it as a token of Ho’s
friendship.
That evening, as he went
about his dressing, in prepara
tion for the Christmas party, his
spirit was heavy. He could think
only of the loss of his friend.
Not wishing to talk, he hur
riedly completed his dressing
and went out, leaving Hester.
“Damn the company’s ruling,”
he said. “Why can’t they trust
us to decide for ourselves?”
Then Kin entered, presenting
the card of Ho, and behind him,
carrying a tray loaded high
with cylindrical boxes of cigar
ettes, came the coolie. Behind
him followed the office coolie,
carrying a tray stacked with
boxes of cigars. Behind him
was the cook with another stack.
And behind him the outside
coolie, with another.
Gravely, Stephen received
these offerings, ordering one of
the tables to be cleared, so all
could be piled upon it. Then
he gave Kin his card to send to
Ho, and, hastily wrapping
money in the remains of some
red paper Hester had been
using, he told Kin to give it to
Ho’s servants who had brought
the gifts. Thus carefully did he
keep the custom.
But when Kin had gone he
burst into wild laughter, not at
all like his own laughing.
Creighton, hearing the unaccus
tomed noise from the Chase
apartment, ran up the stairs,
poking his nose in at the door.
“By golly,” he exclaimed, “are
you starting a cigar store? I’ll
lend you one of the boys for a
Red Indian to stand outside.”
“Go and see what you’ve got,”
said Stephen. “You’ll need your
own Red Indian.”
He had seen at once what Ho
was about; he had spent for
cigars and cigarettes the amount
of the two beautiful presents—
only by spending as much as
they cost could he free himself
from the implication of squeeze,
only thus could he get back his
face.
Through the winter, forced
forward by the combined efforts
■w
NOW READ ON
♦
of the staff, the sales climbed
toward the four-million mark.
The business was at its height in
these winter months, when the
gray rain brought darkness early
into the windowless huts of the
towns and cities. Then the de
sire for light grew. Men bought
lamps and oil to push back the
evil spirits lurking in the
shadows. Shops bought lamps.
The makers of firecrackers gave
a lamp to each woman and girl
working on the night shift;
when the oil was burned out,
then the stint of labor was done
and the workers might creep
home. The modem schools
bought lamps for their students
—boys and girls reading books
from the West, reading the
words of Rousseau and Marx.
Patriarchal -families bought
lamps, and by their lights girls
like Shiao Pao read with flushed
cheeks of individualism and
even of women’s rights.
Black Mirrors
It was spring, the moment
of the Green Valley’s greatest
beauty. In the black mirrors of
the flooded paddies, the young
blades stood in serried lines of
vivid green, in the morning and
evening, each blade throwing’ its
thin shadow on the mirror of
the paddy. The valley floor a
succession of such mirrors, each
framed with green dike paths.
It was after closing hours and
Stephen was alone in his office.
Stephen had just finished his
records of work, preparatory to
turning them over to Creighton,
who was to be the new manager.
He had brought the line of his
graph up to the desired total.
Only two days before, the sales
report had shown him he had
reached the four-million mark.
Memorable years, for he had
lengthened the distance be
tween himself and that haunt
ing dread of all men—failure,
that bitter, disintegrating acid
he had seen at work in one
form in his father, another in
Jenkins, and still another in
Bumham. He was waiting for
Kin to return from the street
where he had sent him to buy
one of the primitive peanut oil
lamps. He had a fancy to take
one of them back with him to
America. Show what trade had
done. Ah, there was Kin!
“Master,” said Kin, “I have
been throughout the city. It
can not be bought. It is no
longer desired by the people of
the city. But they say that
they can send to some village
and get the master what he
wishes.”
The smoky lamps no longer
even made in the city! Stephen
continued to sit tipped back
in his swivel chair, his hands
behind his head. At that
moment he looked very young
—like the boy who had first
come to China. His dreams,
so long forgotten, covered up
in the fierce drive to make
sales, all coming back. The
dream of the little lamps, that
beautiful ardor which had
come to him the night he had
tended Li Tsu’s little mistress—
dream of progress.
(To Be Continued)
Tef.pAon. District 7000
SECRET AGENT X-9 By Alex Raymond
II f ( J Wf THIS’LL DO FINE- || I WANT YOU TO SEND A WIRE B|||||ftPfe£^^^fe nn Til I THF AANA
< A® IT’S FOUR MILES NOW-I WANT TWENTY GUYS Ml I GETS HERE--THEN,THE CAVE ''
FROM THE WELLS FROM OKLAHOMA RIGHT AWAY- M IT’S A FdRT/ J- /
THESE WELLS ARE OURS-BE ’ll ' -7 Tfa?""
■ IT.. CAREFUL HOW Y’ WO THE fl l • A U ~
' CODE MESSAGE M U ■ - —’’SwW
■he bring shaw UR H Bill IMB ~•
joe along '
GANG - ""Sy” illlTl > ■/ ii-J ,if J.
pre- ■/ ; S Mil »Miumiri '•
pares u*Y 11 I
go JIS)/ Jr mBI Phi miMMWMMMfIByihv.4. 141
Wfl I BHBBR! iw
r 71./ lv ■LJlqlllA.il/
VO - 1 A. -- x - - • "" v - \ 101,1 kin 4 <■»><, inc., Crr»t r,.h. w
PIECES OF EIGHT By Charles B. Driscoll
HEARTLESS/ jOK Y I I ARE YOU rj] I CAN I help '
WRETCH Z - C/C/C/r, J JFJ [ ALL RIGHT,TOM, r MISS PRUDENCE
I YES / J ■*nßi- '■
■ T V / * — .. ■■ rz-.. . ■■■••., . . , Mc.Vaught Jnc., NY.
Captain Teach was not one to be bossed about by It was a mere whim of Blackbeard’s. He had in- As Tom and Prudence leaped from the sinking Scud had landed clear of all wreckage, and at
a subordinate. When Pedro .asked permission to tended to let the victims of his broadside drown Good Hope, Tom’s head struck the edge of a heavy once began paddling about in search of the others,
fire a volley into the survivors of the Good Hope, before his eyes. In fact, he was having a quietly plank, and he lost consciousness. Prudence strove meantime shedding all superfluous clothing. He
as they struggled in the water, the big fellow pre- enjoyable time, watching them struggle in the to tread water and hold his head up, but her heavy sighted the distressed Prudence and her charge,
tended to be shocked. water. boots weighed her down. and swam toward them.
TIM TYLER’S LUCK ~ By Lyman Young
7 , rj ■, 7 A. SOUND of the TRUMPET -THE COMBATANTS y ES DAUGHTER,
WE RE TRAPPED, J I/ WE SMALL Hl■■Mßml« ABRUPTLY CEASE FIGHTING, TURN AND SJLENTLY PRINCESS IT IS \thE FINAL CALL
MARCEL, BUT f ra M DIE FIGMTING, WALK OFF-MARCEL JOINING TMEM/Z%,M ARETA! COME \ THE )TO THE GREAT
WE'VE GOT 7 ZX SPEED —— — BACK.'WMERE/CALL < r /-BEYOND
TO FIGHT— X\ (ebAjlX MARTIN J r MARCEL ' <\ n ARE YOU
X V I ! 7a'- lai (
• ii® A\ Dm -'Wn Ly /
IT lAu3k v‘«- v /4W ; '’r ,»' O'
K 11 l*ai rfdziOl MJ IJ a
wWßmnyai I Ui'irwi
RED BARRY By Will Gould
ITrx IP~' ~~ ' ■ 1 OtWI '
(\Kl\ \\ '""7/ \ ••-./•J— i-? bl •• PAYOFF, pT*;: • ■
\VV/ H,LB ® <rel < r V-l «Oiu| <3O II I j fellers!
X * J/ HANDS ADJUST fe/ÜBk .«=§£•• '’ r ' / — I ’ a. 50 LONG, Wyy I IBWI
THE ELECTRODES, ’ OWM
but one thought '\\ \ AtV i S U-— BM2 Hr*""*]/Hl— —Iww
flashes thru BBTJidMfli there I he was 3
THE BOYS MINO, MMMMMHMk. <// jams > GOES THE Ul A SWELL ■■■■■■/ SO LONG,
""MyMond.*,, .JM t > r LIGHTS / i llk K ' D ' 'r
kave failed ire - ‘i ■■llli''
WATS HAPPENED BM "" M- ' ”■■■■■ 111111 118
MLJz to red and ■ JMI /i L IH *umnjgß gßgujwM- ' ■■!
the under-cover II I B Rpt I SMUuMM t n
SQUAD j I ■ I \ B w* I
®ME SIGNAL. FROM ~ BIU / z'- S^VI ""L~ I ■ • 4 ’’/
JJBBjFfBjiW : - r -I- WARDEN KELSEY !! f
MANDRAKE THE MAGICIAN By Lee Falk
II LISTEN, SOR.C IN. WE WON’T HAVE Hu/ a it- makiitd ai/p MARINA, MY DARLING, I i THIS IyOU’RE THE CAUSE OF ' irL*T9J??
ANY MORE NONSENSE FROM WAITI W * NDRAKE ’ ARE YOU ALL RIGHT? J IS A THIS. I’LL KILL YOU, WITH SORCIN,
YOU. KLAGE MIGHT HAVE!-,J YOUR GUARDIAN HAS I SURPRISE. THE SAME HANDS THAT— k STOP/
Mamcdmzc UAO. KILLED MARINA HERE, t —> BEEN A MAD OLD MAN. |‘ — ) i - 77/"" 'Sr- r
NOW VOU--- , U»/ WILL YOU FORSIVE ~ ®ft
KLAGB.THE W'.Jt 75 M V/f 4 7 ——— Q ( \ iV'-jLtfc/
GORILLA WITH /Y \ X W I WiiWF
THE HUMAN Vj K L""• ft >-
BRAIN, CALLED "" jK Z Wg ■
BY PROFESSOR / JK 1. W 1
masterpiece. X
as mandrake i t w
RETURNS WITH dl -.PAv /V 'Zi ™
KLAGE, SORCIN SHEBKfff ‘i W* 1 ' ■ft —’ iV R SWmjMRF-MaiL '' H'* ll
TO THEM y P > I ’ SORCIN, SHOUTING AND BEATING ON
'■ KLAGE’S CHEST, BREAKS THE HYPNO
TIC SPELL UNDER WHICH MANDRAKE
BOBBY THATCH 17 ® By George Storm
( BUT., k -df ~ B|hE EVENING ESSS-"" ~ IF ANYBODY'S a
/> A WAS 7 =4 EMPTY-HEAD, IT’S
■w /'W:4 In sultry ==x THE S Q U,RE H,M “
L 'B-1 and through a self... as he'll
■MgpfjK > ( f— T- BUT AGAIN \ THE OPEN ?y ff ( OH ’ A SOON FIND OUT. /
Har 'M M '""7//// 9K YOU ADMIT \ window 7 boy! A
KWI zkZz 7 there are no I voices IN 1 k 4 ‘
BTI>XV. c —7 — papers in the 7 angry Vi
gWßMcfv? TRUNK.. SIMPLY X DISPUTE
IBImMs because you \ reached the r op
P7!|BlElfrf /I HEARD A BRACE I BOYS WHO DIDYA HEAR NR
OF empty-headed Jwere seated that I. he’s
y school boys say 7 ON the got the i 1
( I D PAV A GOOD ) MARGIN OF TRUNK BUT
X PRICE FOR IT, IS THE SQUIRE’S THAT’S ALL '
lr : . ■‘ ~ -& CO) NO REASON C LAWN. HE’S GOT !! i
BJBHBBSBn I FOR YOU T °’-- ) v
1035. by Featarv*)
*
THE WASHINGTON TIMES, WEDNESDAY, JUNE 12, 1935
TefepAon* District 7000",The Washington times. [volume]
['Washington'],['District of Columbia'],19350528,sn84026749,"“Oil for the Lamps of China"" ♦ + By Alice Tisdale Hohart
Western Life, Love Clash With
Ancient Ways of the
Far East
'(This is a serialization of the Cosmopolitan production
joon to be shown at Warner Brothers’ Earle Theater.)
‘ WHAT HAS GONE BEFORE
After three years in Manchuria as a field man for an
oil company, Stephen Chase planned to marry Lucy, his
American sweetheart, during his furlough.
Lucy finds Stephen a veritable stranger and refuses
to marry him. He then marries Hester Wentivorth,
whom he met in Yokohama. Her father had died on the
trip to China.
They live in a company hut in Manchuria but Stephen’s
'duties keep him from home. The company adopts, his
plan to sell cheap lamps.
Hester loses her baby at birth and returns to the
“States” ahead of Stephen. They return to Manchuria,
where Stephen has been given charge of a division.
Ho, a venerable Chinese, becomes his adviser and aids
him to understand the psychology of his countrymen.
NOW READ ON
“We want to hear all about what you’ve been doing,’’ said
Mrs. Breckenridge, the tall, thin wife of the manager of the
British Oil Company, as they entered the room. “Robin wrote
that that husband of yours doesn’t play fair, works all the
time. He daren’t take a vacation because of him.’’
, When the callers had gone she gave pleased attention to the
► house coolie pushing a cloth over the high polish of the native
varnished floor, leaving the space between Hester and him
>elf gleaming like a dark red mirror. He had restored the
gleaming perfection of the mirror when Hester came in again
from the hall with Stephen.
“What is it, Stephen?” ♦
■ When she had met him in
•the hall her mind had taken
’hold of some difficulty within
him which had not been there
'in the morning.
“Come in here,” he answered
her, passing on into the greater
privacy of their bedroom. “I
'can’t get their cooperation, not
*even Boynton’s this time. If
they don’t do it with under
standing it won’t be any good.”
“What is it you want them to
-do, Stephen?”
“I couldn’t explain it to you,
I mean, I couldn’t now. It goes
’back . .
“Perhaps if we had them to
'tiffin, you could make them un
'• derstand. I’ll sent a chit right
now.”
As they took their places at
’ the table there was a con
strained movement. Then Hes
.■iter began searching out the dis-
• eonances of the group. She drew
.forth the youthful self-assurance
of Fenton; and lest to Stephen
.he seemed insolent in his cock
sureness, she turned the theme
""away from business, to allow
him to talk of his fiance in
America.
•- Now the conversation swung
""comfortably back to their work
-and to the discussed problem.
Boynton, sitting at Hester’s right
•- hand, half turned in the chair,
forgetting her in his interest in
-what Stephen was saying.
“You see,” Stephen began,
“this plan is aimed at making
another class of Chinese want
light. Whats got to be done is
to get small tradesmen out in
the country districts thinking
about light, wanting light.
“To get the business I want
you’ve got to imagine the state
of mind of men who count
their day’s business in cash —
• cash, a two-thousandth of a
dollar.”
“Well, I guess it’s a sound
Idea,” Boynton conceded.
“We’ve been shooting too
.high.”
Long before, Hester had let
jgo their talk, her mind idling
outside the orbit of their con
-7 versation. And a new sound,
'heard for the last hour, but
hardly noticed by the weight
of its repetition at last bore
down upon her. “Hai-yo-oh, hai
i yo-oh, High-low-o, high-low-o!”
- A great weight thudding down,
..Accenting the chant made by
the jarred breath of the lab
orers.
“Ho’s begun his foreign
house,” said Stephen, breaking
into the theme of his own con-
• yersation.
Kin came and spoke softly to
'Hester, telling her a new curio
•<anan had come.
She made a little shift of her
• chair, essaying her departure.
1 Stephen looked at his watch
and rose quickly.
“I had no idea it was open
ing time.”
New Markets
For a moment they all paused
at the window, looking down
at the preparations for Ho’s
.three-story brick house. A cor
nier of the garden wall had
been tom away, a scaffolding
of bamboo poles had been
erected. Four men stood upon
\ a platform, ropes In their
hands.
2 “Hai yo-oh, hai yo-oh.” The
‘human pile-drivers hauled up
the ""enormous wooden hammer,
dropped it.
“Look at them, millions just
like them in this country, lit
tle more than animals,” said
Fenton. “Do you expect us to
make them want light?”
“Yes,” said Stephen, “that’s
our market.
As the men went away to
their work, Hester knelt by the
pack of the peddler, idly
watching him take out his
wares.
“TelPhlm to take it all away.
Kin,” she commanded, pushing
from her lap a little pile of
objects she had half thought
she would buy.
< “Tai-tai,” the old man spoke
DfwHct rooo
softly, picking up a cloth-cov
ered gray box, pulling the inch
long bone spear of its fasten
ing thrust through a loop of
red braid, “look see.”
In a shaped space fitting it
accurately there lay a perfect
piece of porcelain. An artist
had made that, Hester knew.
An artist of centuries ago, for
the making of such porcelains
is a lost art. She coveted the
vase.
Quickly she turned her atten
tion to a vulgar brass image of
the Laughing Buddha, cun
ningly expressed interest in it
and none in the treasure she
coveted, thinking to lessen its
price by her indifference.
Kin, watching the old man
sitting back on his haunches
bargaining with Hester over the
Laughing Buddha, detected a
slight movement of her hands
toward the valuable porcelain.
He moved his foot a trifle, in
dicating to the peddler that it
was there the tai-tai’s interest
lay.
No, said Hester, she did not
want the image. But what of
this other thing, this bit of
porcelain? It it were not too
dear she might take it.
When the curio man stated
his price she rose and walked
away.
“You no wanchee anything?”
he called after her.
But when Hester returned,
the bowl stood upon the table
where she had planned to place
it. When she summoned Kin,
asking the reason, he said the
man had insisted on leaving it
a day for her to look at.
Suddenly the afternoon was
vivid with interest for Hester,
a new idea forming in her
mind. Everything in this room
beautiful, the other rooms, too.
Things which only the privi
leged manager’s wife could own.
She reached out covetous hands
for the vase. She must have it
at any cost. In the days that
followed, with excited energy
she offered her spirit one lovely
thing after another.
Chapter 23
Day by day Ho’s foreign
house grew taller, the scaffold
ing of bamboo poles, tied to
gether with hempen strands,
standing so high that the red
flags on their tips, placed there
to keep away the devils, floated
level with Hester’s windows.
One day after Stephen and
Ho had ended the morning’s
business, Ho spoke. “Tong ja,
there is a little matter that
pertains to my family.”
Stephen was startled into at
tention. Ho speaking of his
family to him, who had never
been beyond the garden of the
great house!
“The wife of my third
50n...”
Ho considering his daughter
in-law! There was a change
coming over him since the death
of his old mother. First the
foreign house, and now speaking
to Stephen of the women of his
household.
Occasionally Ho had spoken
of this or that son. His oldest
son, Stephen knew, was a disap
pointment; and that the third
son was his fdvorite. Once Ho
had brought this third son to
the office. He had seemed an
odd mixture of gentleman and
coolie; a thin face, aristocratic
in shape, the mouth heavy and
the nose as flat as a Negro’s, the
nose of a coolie. But the eyes
were what impressed Stephen—
honest, faithful eyes, strangely
revealing in their expression for
a Chinese. Ho’s third son was
tall, too, like his father. Stephen
wondered what the wife of this
boy of seventeen would be like.
“My son talks of the school
in the city, where girls learn.
Day and night, he does not
cease to speak of it for his wife.
It seems it is becoming the cus
tom. Perhaps good, perhaps
not good. He wishes her to learn
your speech.""
.(To Be Continued),
SECRET AGENT X-9 By Alex Raymond
I THERE’S NOT A FIVE MEM AND A FAST ) S p A R ETI R E
_ MOMENT TO LOSE- CAR-ThiS YOUNG LADY I
In IT’S PHILIP SHAW, L—> WILL DIRECT J—s' I WHILE, IT TO YOU / MAKE
THE THE SON OF THE THE WAY H l ’**
■w EjfrWJl mOrJR
gets "" fcfcJF IM unable
IMMEDI- / • BF /JtXW WK/Z lf.l I JfrTkU J /VW /KU 1 .
ate \ '• ' rA- j ii « "" a ride M IT i
co-oper- / /L J f t r ° m ISKSBUf. 'wk
famous • 1 <. m ® fiSOluS
RANG- -r . TTbi ill >r* <1 R II v- • '• /W
ERS rr? ■ ‘ \{|l —rM-
L4.dr i tommy- The car door swings open
Guw and x-9 staggersgrogg i ly
V* .•• •»<. KI« - ‘MTO the road /
PIECES OF EIGHT ' By Charles R. Driscoll
1/ ixl man lru.A6HTHinl "" sink me, gladto ✓—l
> s' 495. \ island/ u SIRf
As the pirates from the strange ship lying off He saw six ruffians straining at the oars, and in Captain De Gama, Prudence, Jerry, and Tom As Blackbeard’s boat drew up to the bank, Cap-
Blackbeard Island approached, Captain Bonnet the stem a tall, broad-shouldered man—with bushy urged Stede Bonnet to fight. They were joined by tain Bonnet himself stood by to receive the noted
handed his spyglass to De Gama, while the latter’s black whiskers! “Blackbeard, unquestionably!” he 6 pirate with gallant courtesy. Bonnet s men cluster
little group clustered around. The former skipper said, sadly. There was a brief consultation between But Bonnet could not see how his pirate near the people from the Good Hope kept in
of the Good Hope stared steadily. the two. career could be helped by fighting another pirate. the background.
TIM TYLER’S LUCK Dy Lyman Young
■V'' I WEVETRIED OUR icttm ' .adhc SPEED MARTIN, I HAVE I W lINSTINCTIVELY SPEED TURNS-SIDE-
BESTTDOETTMESUMMONED NOU To ASK y YOU WOULD STEPS A DEADD/SWORD-THRUST
PRINCESSAWA/,/ VOUVE X WHVVOU AIDED MV ] HAVE HER MARRY MR AND SENDS COUNT RELLOS REEUNg-
r /sj BUT MERE WE / NOT SIVEH \ ™rY) D // DAUGHTER, PRINCESS AR£TA/ COUNT RELLOS, (
ARE IN A ( UP ALL • TO FLEE / QUEEN ANTONA
DUNGEON \ MOPE, SPUD 7 -ASM FROM ME? ANDIWISMTO ( INSOLENT ) \
L CELL, J)) MARRY HER, \CUR, IXL-/ /?¥ \
I speed /AV
Xrn -< z 1
Hill vx W 1 Ir //i // r **
li E 'X ■ JI/ {3 / zSK z '
__ I n I
RED BARRY By Will Gould
/TXA AH ALLEY LEADIMG TO LOOK, SUBGUM, |'a\ GOHHA LBTCHA
CgIMSHAWS QUARTERS.—« SEE-AH''JES' WHEM Y'THINK YOIARE h/ MISSY < ••:: ’
t GOIH* GOOD -HIC-I'NX GONNA PUT A FT* GRIMS— .*X 7-"" • /
■ BUT MISSY MISSY GRIMSHAW J■ I SAY RL, PERIOD- hig- RIGHT IM ’feaesdd OH-H “H !! Z A
I GRIMS'AW NO )> I WANNA SEE-HIC- ) I MISSY BREAPBASKET .. -XJx Z ; ' ' V
HERE MISTER GRIMSHAW.' I GRIMS AW
| no here!.' / . - i
7k : JXfkVll Lsumum- J
Rft / ill 1, I ■ you're S AzILgLK F \ L
zt ■KT / iff 71 K
Il h u ""3 ■Mi i /Mio
Hl ■♦““MS | Rhl . -XX
MANDRAKE THE MAGICIAN By Lcc Falk
~l| RUN, MARINA ! SCRAM, WILL YOU ? - I ’ I HOW LONG HAVE A LONG TIME,
THIS ANIMAL'S TOO DUMB TO JJk jMrX ’ * 9 A DANNY! SR* vW| l , I BEEN LYING MISTER MANDRAKE.
KNOW WHEN HE’S SHOT. H HERE, SUSIE? L S THAT BAD MISTER
— - ATyT. — .J. k funnyman just
MANOMKM
FRIEND, INSPEC’ 1 “’YOU-’DANNY. :< WW»4 & O 5 x> I ■■ t
TOR DANNY : v > u - •• M T jtirjJiL. V ~D
sayers. faces -hiUlj / TUB JS ••• , • \J??KiSL
has escaped. <JMJ .. •// 1 V
DANNY’S W A -WL
BULLETS SEEM Zjttaßi . W-
THE MONSTER. "" ffil k C/Z • T\J
' ' s ' M f u (vQOk<- Mandrake regains consciousness,
’■ MB ‘ * AFTER HAVING BEEN FELLED BY KLAGE.
g-ae llmwWMkm ifiranfe..-.
ROBBY THATCHER By George Storm
/ HOLD ON I THIS r L L HOLD NO Ml f fLL COMB Our THE NEXT
( TRUNK MIGHT HAVE MORE TRUCK || BEARD, SLICK UP‘N THING IS
-A B’LONGED TO THE WITH THEM Hl SEE H,M AT H,S HOUSE ( TO RAISE
( SQUIRE’S GRAND- BOYS..I’LL ‘i TOMORROW NIGHT, THt Two
I PAP...MEBBE WOWfr SEE THF U DOLLARS WE
■ ( THAT’S WHY OLD W PRICE THAT LL ""< K AGREED TO
TUk HE WANTS / /VZ) WEAZEL "" L MAKE ' ,M f J M oav m n
BD* 1T*...! I’VMjK rtMX myJ£f! ”!""' 1 SQUIRM. PAYOLD
M JgSpVy > / /#/) )> MYSELFI \/ TURTLEBACK.
nfcfyxyjjkyl - V AX 'l l J. <1 Z aWSski but there’ll
■J J I r~ nW U ' ffiffilE < Tfflfcs m BE TIME
h v Bi I enough for
OIL I THAT
z ~ X f
> > o
THE WASHINGTON TIMES, TUESDAY, MAY 28, 1935
Trlapkonc Dhtrict 7000",The Washington times. [volume]
