city,state,date,lCCN,text,title
['Honolulu'],['Hawaii'],18570606,sn82015408,"THE POLYNESIAN, JUNE 6; 1857.
39
IQ
lot
ie-
be
he
le
ct
in
.
h-
rd
ds
il.
ce
50
P.
1
i 1 f
Y. Drutnmond, United Mates Supreme
I '? In Utah Territory, by the Administration,
a sad ana depiorarue picture oi matters
PrCadlMi i O w. .-muo.m. -
of Wnahinorfun. arch VII
(if WUH ICWinu r . t
- nves
that Territory.
fj.jtwr
The following is taken from
i ""The leading men of the church are more traitor
? .ion (.vor."" Only a few days since all the pa-
j. .l..L'it :ind tnn hundred vo!iiiiipr
e.)iU!. w'-'""'
.""'- Jaws, were taken out of the Supreme Court
1'?'$ office, and burned. And this is not the
f i;nt mce 01 liie miw. a wy iu yu o""ani unu
I""'- i V(lU to the President, it is impossible for
ffn entree the laws in this Territory. Every
P i. -re holds his life at the will of Brighani
v - r onj line; w im wVv.vbAiit . 4u
I CjTof opiiiion that Dabl.it was murdered by
f rut.-ns under direction of Brigham Young, and
Z t br In Jins-
f'yJrJer is a common thing here ; and Mormons
i . l .,ir.c'it'il with a Mnrmon inrv. vvitrifss-
uUDJl UL l """" .
..r aul Governor to pardon, it is too
1 and must not be endured. A man, not a
5? .ui''or of the church, is murdered, robbed, cas
jjand imprisoned, solely for questioning the
-huritvot the church. Persons are now in the
rirent'iary, convicted before the Probate Judge,
- vViiv innocent of any crime. Is there any oth-
V countrv where this abuse is or would be endur
f'jl it"" all, then, take bold, and crush out one
5 "",f tTje most treasonable organizations in America. ""
I'.i administration have had the matter under
Serious consideration, and will soon appoint a
hj'vernur, I understand, who will take a sufficient
iaiiliurv force into that Territery to carry out the
lUwstJ the fullest extent.
China.
i The Moniteur de 1 1 Fiotte publishes the folio w
reclamation from the Mandarin Governor of
liVhauipoa:
I Infamous foreigners have presumed to raise the
I .indarJ of revolt against the sublime and venerat-
! j authority of t!ie Emperor. They have attacked
ik'city ot Canton in order to fmrn it, anu already
have they received the punishment they merited,
fur our invincible troops have repulsed them, and
tilled a great numfk-r of them. Let them be at-a.-keJ
from every part of the empire. L.-t every
ia'.abitant of China who shall meet an Englishman
iaJict on hiui the, fate he merits. Already do our
innumerable fl.ets and our mighty armies, which
are dreaded by the whole world, advance to drive
tLeaiawiy. Lot every bidy unite with that army;
kt every on-i take part in the war, and teach ior
tL'ners tj tremble Iwfure- the will and before the
anier of our Sovereign, whose gaze is as burning
as t'ieravsof the sun, and whose power is im
measurable. He who shall not act in conformity
with these orders, shall Iks considered as a traitor,
and may expect frm us a chastisement as prompt
as terriWe. You hear! Oby.
The Mandarin Governor, TC1IYX-T00.
Dane at Whampoa, the 9th day of the 12th
moon.
The Moniteur de la Fiotte says, on the publica
tion of the preceding document, the foreign ships
anchored in the roads or iu the Tchou-Kiang sailed
iivay, taking with them the few Europeans in the
town. The utmost excitement prevailed.
Coolie Horror.
The French shin Port de Bordeaux left Macao
i'uut the middle of January, bound to Havana
with a cargo of Chinese, apprentices When one
out, an alarm of fire was given from the be
tween decks forward, and in frantic haste the offi
cers and crew ran down to put it out. No sooner
'.vera they there than a large number of the Chi
nese went aft and took charge of the arms, and
then quietly told the master that the alarm was a
ruse devised for the purpose of procuring his re
turn to Macao. Some fifty or sixty of them, they
said, had taken thir passages on board thinking
the vessel was going to the Straits only ; they had
not agreed to go to Havana, and go they would not.
Of c mrse, having no choice in the matter, the
master hove a'ut immediately, and on reaching
Macao threw up his charter. The actual appren
tices made no demur to being trans-shipped, and
have Knee left in a Dutch ship. The tale, given
to us on what we believe to be excellent authority,
appears incredible. It is incredible that European
Agents, after so many warnings, should still ex
ldlit sa much laxity in sending Coolies away ; and
so less incredible that the Chinese should exhibit so
Each wisdom and praiseworthy forbearance.
After the above was in type we learned by the
schooner Mazeppa of another Coolie Horror.
As the Mazet.na mssed Breaker Point, she saw
I there. lAAi and ilrv. the French shin Armais.
i mi,. ' 1 ' J ' r
i inis vessel was despatched from Swatow recently,
t a cargo of Chines-5 apprentices for Havana.
I The day alter leaving the master was cut down with
a hatchet, and th.3 other officers and tome of the
J ?rew despatched in detail. The vessel was after
wards run ashore where seen by the Mazeppa, and
he Chinese, said to number some six hundred,
ent their ways. The rest of the crew are in the
hands of the villagers, and, under the supposition
that thev are English, will !o massacred, unless
sPeedilyrescued. Friend of China.
A resolution to amend the Constitution so s to al
low colored persons to vote without a property qualifi
Jion, has passed the New York Senate by a vote of
- yeas to 5 nays.
. millions of dollars, it is said, have been spent
sithe search for the unfortunate navigator, Sir John
GENERAL ADVERTISEMENTS
R. H. A. S.
rjplIE LIBRARY OF THE AGRICULTURAL
JL Society has been removed to the Office of the
undersigned, where it is accessible to members dur
ing the day. J. F. B. MARSHALL,
. May 15, 1857. (2-Gt) President.
Cargo on the way for the Fall Season !
DEALERS, STOREKEEPERS AND THE
Public generally, are respectfully informed
that the splendid new clipper ship
""KAMKIIAMEIIA IV.,""'
John Garky, master, 500 tons register, 800 tons
burthen, A 1 at Lloyd's for fourteen years, was to
sail
FROM LIVERPOOL
For this port direct, be tween the 10th arid 20th of
this month (April), with one of the largest, most
valuable and con.plete assortments ever brought to
this market m one vessel. She will be due here
early in August.
SAMPLES of Dry Goods are expected in about
six weeks, due notice of which will be given.
April 23, 187.-51.tf ROBERT C. JANION.
Notice.
A LL PERSONS ARE HEREBY NOTIFIED
t that the herds of 'Wild Cattle belonging to his
Majesty and the Government, running in the dis
triets of Hilo. Hamakua, and South Kohala, and
between Maunakea and Maunaloa, in the island of
Hawaii, have been this day sold to Mr. E. P. Adams.
By order of the Minister or the Interior.
S. SPENCER, Chf. Clerk.
Honolulu, April 22, 1857. ol-tf
JUST RECEIVED AND FOR SALE
FEU ""II A I) UG A,"" from Boston, the follow
ing Goods :
White Cottons, Brown Cotton Drills, Blue Drills.
Blue Cottons, Brown Cotton, sup'r Denims, Bl'd
Flannel, Men's Kip Brogans, Women's Shoes, Men's
1 1 ats.
Pure White Lead, Black Paint, Chrome Green.
Chrome Yellow, Prussian Blue, Celestial Blue,
Boiled Linseed Oil in cans 4 gall, each, Spirits of
Turpentine.
Bbls. Haxall Flour, Water, Soda and Butter
Crackers, Lemon Syrup, ground Black and Cayenne
Pepper, ground Cloves and Cassia, fine Table Salt
Castile and Saltwater Soap, Hams. Cases of Oys,
ters. Roast Beef, Boiled Beef, Peef Soup, Lobste
and Green Peas, in 1 and 2 lb. cans; Tomato Ketchr
up, assorted Pie Fruits. Brandy Peaches, Corn
Starch, bottles of Ground Ginger, English Mustard,
Dried Apples in half bbls., Eng. Cheese, Saleratus.
Nests o Trunks, 4 each ; painted Tubs, nests
painted cov'd Buckets and Boxes, assorted Solar
and Glass Lamps, Solar Chimneys and Lampwick,
Shoe Blacking, Writir.g Ink, Sheet Lead, Cut Nails,
ass'd; Copper and Iron Tacks, ass'd; Ship Scrapers,
Coflee Mills, patent Charcoal Irons, Tin Pans and
Plates.
A complete assortment of STATIONERY, Sc.,
&c. Sec. II. HACKFELD & CO.
Honolulu, March 12, 1857. 45-tf
RITSON & HART,
DEALERS IN WINES AND SPIRITS,
T THE OLD WINE STORE, under A. P. Ev-
erett's Auction Rooms, offer for sale
BRANDY in kegs and barrels;
MarteH's;
United Vineyard Proprietors;
' Sazarac;
RUM in kegs;
JAMAICA RUM in cases;
Genuine OLD SCOTCH WHISKY- in 1 doz cases;
M ON ONG A II EL A WHISKY, in bbls. & kegs;
Fine OLD MONONGAIIELA WHISKY iu 1
doz. cases.
HOLLANDS GIN in cases;
SCHEID AM GIN incases;
Wolle's SCHEID AM SCHNAPPS;
IIOS TETTER'S BITTERS ;
BOKER'S .
STOUGIITON'S
CLARETS of different kinds;
HOCKHEIMER;
SAUTERNE;
CHAMPAGNE, pints and qts., different brands;
SHERRIES, Pale and Brown;
Fine OLD POUT;
Byass' and other brands of ALE,
PORTER;
LIQUEURS.
461 Ships' Stores, Daty Free. ftf
CSUTIIE MARKET.
J. A. H0RNIBL0W, BUTCHER,
WOULD respectfully inform the
citizens of Honolulu that he has leas
ed the premises formerly known as
the ""Familv Market."" on Kins street,
and will open the same on the 1st of April, where
can be had everything pertaining to the butchering
business. The patronage of the public is respect
lull y solicited.
N. B. Orders delivered to any part of the city
free of extra charge.
w
INE. Butter, Soda and Water CRACKERS.
For sale by 43-ti oa v ioox. u.a x .
li
EA & PERRIN'S Worcestershire Sauce. For
sale by 43-tf SAVIDGE & MAY.
TTTlNGLISII HAMS, just received and for sale
iCi by 25-tf. T. MOSSMAN & SON.
BURTON ALE, in togshea, for sale by
47-tf ROBERT C. JANION.
HOUSES, LANDS, &C. -
COMMERCIAL LYCEUM TO LET,
Y THE -NIGHT, -WEEK or MONTH, togeth
er with Wardrobe, Library, &c. &c, complete.
For particulars, enquire of
48 3m II. MACFARLANE.
To Lease from One to Ten Years,
A LOT of KALO and PASTURE
LAND, situated at Waialua, Oahu.
This lot is well adipted for cultivation,
and is the one so generally known as
being tatuated in the midst of an avenue of magni
ficent Ohia trees. The Kalo lands are irrigated by
living Springs, which abound with a plentilul sup
ply ol fish. For furthe rparticulars apply to
48-tf HENRY StJOHN.
TO LET.
A CONVENIENT COTTAGE and
spacious grounds, situated on Smit hst.
There is a good cook-house, well cf wa
ter. &c, &c.
jr oi terms, apply at the National Hotel.
ill
46-tf
JOSEPH BOOTH.
Lands for Sale.
13 1-2 ACRES of valuable Land,
Macfarlane's Baths,"" in Nuu-
W&i ymn near ""
&Npanu Valley.
ALSO A fine House Lot in Honolu
lu, nearly opposite the Palace, on King street.
For information and terms, apply to
February 21st, 1S57. (43-tf) J. W MARSH.
IdH m
fpX J
FRENCH HOTEL.
t
THE undersigned being about to
leave the country, oners for sale the
entire business, furniture and stock
of this well-known and desirable
stahli;hment.
The grounds are extensive and well stocked with
flowers and vegetables. The mountain-water has
been laid on, and carried to several parts of the
premises at great expense. The bath-houses are
convenie nt, and the numerous suits of chambers are
cool, well ventilated and comfortably furnished.
The establishment is centrally situated, with three
several entrances on different streets, and altogether
presents a rare opportunity for persons desirous of
embarking in the Hotel business.
Full particulars can be learned on application at
the premises to V. CHANCEREL.
Honolulu, Dec. 12, 1856. 32-tf
TO LET.
rPHE NUUANU BATHING Establishment with
I everything complete. Applv to
' II. MACFARLANE,
43. tf Commercial Hotel.
To Lease in Lots,
THAT PIECE OF LAND, Corner of
Suuanu and King Streets. -Apply a the
storeof T. MOSSMAN & SOW,
12-tf. Nuuanu Street.
M
To be Sold or Let.
A LARGE and commodious residence in Nuua
nu Valley, about a mile and a half from town.
Terms moderate. Apply to W. L. GREEN.
Honolulu, June Hth, 1856. 6-tf
II HAL ESTATE.
rBlO LEASE, after the first of July next, the
JL WHITE SWAN HOTEL and Premises.
Apply 'o 4tf E. O. HALL or J. W. MARSH.
?T2OOMS TO LET from $1 per week. Apply
isL to S. JOHNSON, House Carpenter, -52-tf
Merchant street, near the Royal Hotel. .
A
7-tl
TO LET.
DRY GOODS STORE in Nuuanu street, ap
ply to II. MA Cr AULA WIS,
Commercial Hotel.
FOR SALE.
Finrst Ruildtns Lot Xuuann Valley.
ALL THAT LOT OF LAND opposite 10 Judje An
drew's privt-V reiilen( e. extending from the Nuuanu
Road hack to the River and lying between Governor
Kekuanaoa's House Lot and the property belonging to J.
ltohmon & Co., containing an area of 'J 923-1 00J acres.
The anove lot is well watered, is a convenient distance
from the town, commands an extenive ami magnificent
view, an 1 is akoiether one ol the most favorable locali
ties for a gentleman re.idrnce in the neighborhood of
Honolulc. particulars apply to
19-tf. W. WEBSTER.
Land Agent to'Hi- Majesty.
CMIIi
CHAMBERS, TWO IN SUITE.
fL TO V.v LET EDEN ( CHAMBERS, on
y,i Nuuanu street. Rent torcvery two rooms liO
per month,' payable in advance. . f
Apply to Mr. GEORGE WENTZEL, who
lives on the premises. zo-u
For Rent or Lease.
rriiia -ul-known Hospital Premises on Waikiki
1 Plains, dth all the improvements necessary for
the comfort ot a family.
These premises comprise an area of about ten
acres, and are w ell fenced. Apply to
42-tf JOSEPH BOOTH, National Hotel.
TARRED ROPE, Manilla Rope; Canvas, Paint
and Boiled Oil, for sale bv
47.tf ROBERT C. JANION.
NEAPOLITAN MACCARONI and Vermicelli,
Tapioca, Pearl Sago, Carolina Rice. For sale
by 43-tf SAVIDGE & MAY.
BLACK AND COLORED
Satin.
FIGURED DAMASK
Camlets.
CHANGEABLE
Silks.
COLORED
S'oiigec.
MELCHERS & CO.
HOUSES. LANDS, &c
STORES TO LET.
rniWO Wooden Stores, with Counters, Shelves,
ji. etc. Apply at tne uommerciai iiotei.
Also, a Lot of Land ODoosite the residence of Dr.
Judd, in Nuuanu Vuey. Apply as above. 45-tf
STORAGE. The large and commodious cellar
3 under the National Hotel Dining-Sloon. For
terms, apply to JOSEPH BOOTH,
JN auonal llotel.
Feb. 27, 18KS. 43-tf
ripO BE bOLU, OR LIST lor one year, witft
u nossession from the 1st of January, 1857, the
commodious Dwelling House in front of the Gov
ernment Oifices, at present occupied by the Honor
able David L. Gregg, Commissioner of the United
States
Apply to Mr. WILLIAM JARRETT, -
31-tf At the Foreign Office.
To be sold or let.
rpWO VILLAS, each with every convenience for
1 a faiui'.y, m Nuuanu Valley, close to Ro.ebank.
Apply to MRS. PATY,
on the premises or in 7onoiulu to.
or C. C. HARRIS.
Honolulu, Nov. 30, 1855. 30-t
FOR SALE.
EVERAL COTTAGE SITES in the Valley ad
mininj the Village of Honolulu consisting of
hicrhlv productive Kalo lands, Avith never failing
streams of water, and a fish uond. Also, a Tract of
jour lots on the plains, bounded by three streets.
enquire at this omce.
To Let,
ft"" For a term ot live years , or more, on reason
ktllil able terms, that portion or LOT OF LAND,
situated on Waih't Plain (adjoining the lots on
Thomas' Square,) and belonging, in fee simple, to
Mr. Joseph Henry Ray.
For Terms and other particulars, apply byletter.
addressed to Mr. JOSEPH HENRY RAY, or his At
urnei care of the Postmaster. Honolulu. 29-tf
rrO LET. Sleeping Rooms. Enquire of Mr.
I HUMPHREYS. Garden street. 1-tf
Notice.
rrnllE SUBSCRIBER respectfully informs his
B friends nnd the nublic jienerallv, that he has
taken the stand lately occupied by C. W. Vincent,.
King street, where he intends carrying on the Car
pentering business in all its branches J obbing done
at the shortest notice. A share of patronage is so
Ucited. GEORGE MILLJSU.
Honolulu, Dec, 15th, 1855. 32-tf
r CAPTAINS OF VESSELS can obtain from J.
-nTTTlOIT'S nlace. Kalihiwai. Kauai, the fol
lowing fresh provision: Beef, Pork, Mutton and
Poultry, on reasonable terms.
Also, ire-wooa m any quantity.
infrrmjtioiireirardini:the harbor and anchorage,
can be obtained at the store of R. Coady& Co.,Hor.-
olu, Oahu.
NEW INVENTION I--TIN BAKERS.
TRM1E SUBSCRIBER is now manufacturing and
JL offers for sale, at his Tin Shop, Kaahumanu
street, opposite Makee's brick store, Lockwood's
t'iitent Tin Baker, which, for the use oi a fami
ly, will be found to excel anything of the Kind ever
seen here. It is light, takes up but little room, and
may be used for either Coal or Wood. Price $10
each, with bake pans and kettle.
. 46Itf JAMES LOCKWOOD.
F
by
upwui Piinrni.ATE. French Olives, French
i t...fn.i nT.Tnni Anohnvies in oil. Foi sale
SAYIUUIS JUiVl.
43-tf
rznHE UNDERSIGNED oilers his services to the
JL public in the capacity of Arbitrator for the
settlement of legal and equitable controversies, lie
will also give legal advice, when required, attend to
conveyancing, drawing wills, &c, and all other
branches of chamber practice.
ALEX. CAMPBELL.
Honolulu, April 8. 1857. 48-tf
T RON BEDSTEADS, single, double, and chil-.
1 dren's; Sugar Mills, Coping Presses, Coffin
Furniture, Brassware, Chests of Tools, Door Scrap
ers, &c, &c. , for sale 6y -Tw",Polynesian. [volume]
