city,state,date,lCCN,text,title
['Bridgeport'],['Connecticut'],19200223,sn92051227,"TWO
THE TIMES: MONDAY, FEBRUARY 23, 1920
Howl and' 5
NEW INVENTION
.6
MAKING TOES DO
WORKJF ARMS
Light Cigarettes, Comb Hair
and Use Hammer and
Nails.
Forecast: Fair, today, continu
ing Tuesday.
Bridgeport, Conn..
Monday, Feb. 23, 1D20.
Daffodils,
Freesia, Sweet Peas
and Tulips
In Main Street. Fair aria Avenue, and Cannon Stree
Un WY ml
REPORT STATE
PEACH CROP I
90 P. G. RUINED
Cold weather has ruined 90 per
cent of Connecticut's peach crop for
the coming season, according to a
statement yesterday of Leonard H.
Healey, secretary of the state board
of agriculture. Large growers have
reported that frost has killed virtually
enUre crops. Mr. Healey said he
thought a small percentage of the
usual crop might be harvested.
Former Senator Elijah Rogers, who
bats a large fruit farm near Southing
ton, reported heavy damages, and
doubted if his harvest would total
an appreciable quantity. Stancliffe
Hale of Glastonbury, one of the state's
largest peach growers, said he would
be more thoroughly informed as to
the condition of his own prospective
crop within a week. According to
Secretary Healey, L. C. Root of Far
anfngton, another large grower, re
ports heavy damage to trees by recent
cold weather.
Mr. Halo said he had been told that
the heaviest damage occured along
the shore, where entire crops in the
formative stages have been ruined.
The state board of agriculture, how
ever, reports practically the same
condition in all sections of the state.
""We haven't failed this way three
times in the last twenty-five years,""
said Mr. Rogers.
""My crop was practically gone In
December,"" said Mr. Root. ""The
thermometer registered 8 degrees be
low zero in the orchard.""
A bulletin issued by the Connecti
cut Agricultural College at Storrs
contains the following announcement:
""There will be no peaches grown
in Connecticut this next season. Ap
ples and pears will be in demand.""
Both growers and officials of the de
partment of agriculture question the
literal accuracy of this statement, ex
plaining that a small percentage of
the crop will be harvested.
During the past season, however,
a noticeable shortage of local peaches
was felt by commission merchants
and other dealers in the city. The
crop was unusually light, and at the
end of a few weeks local markets
were fulled with peaches from Dela
ware, New Jersey, the South and California.
AMERICA GETS
HARD ""PANNING""
FROM DUTCHMAN
Amsterdam, Feb. 23. An unflatter
ing view of America is given in an
interview in the Amsterdam Telegram
by William Oudegeest, who recently
returned from attending the inter
national labor congress at Washing
ton Among other things, according to
The Telegraaf, Mr. Oudegeest found
that in the United States.
Politics are at this moment on a
level with those of 1S40 in Holland.
Economically, America has got to
the stage of 1880.
In the light of culture the Ameri
can still lives in the 18th century.
""One gets the impression,"" the
Telegraaf quotes Mr. Oudegeest as
saying, ""when he is in America, that
he is in the closing days of no
bility, when the peasants thought
their noble lords the only things of
importance in this world, but with
the difference that the bankers and
great business men take the place of
the junkers and barons.
""General education is very low.
People do not read.""
Edinburgh, Feb. 23. A simple, in
genious machine, which enables men
to use their feet as hands, promises
to brighten the lives of those who,
by the mischance of war have lost
both their arms. The invention is
the work of George Thompson, an
Edinburgh gas fitter, and it has every
chance of being taken up by the
British Ministry of Pensions.
""It is most useful,"" says Mr. Bail
ey, the Ministry's expert on artificial
limbs. The machine alho has won
the approval of Sir Charles Kender
dine, director of the artificial limbs
department. Points strongly in its
favor are its simplicity and its cheap
ness. ""It is easy to construct and even if
it is worked on ball bearings,"" Mr.
BaiJey remarked, ""it should cost not
more than 20 pounds. If it proves
to be all that it is claimed to be it
will be supplied to all who need it.
The point of view of the Ministry is
that too much cannot be done for the
war's armless victims and the deepest
interest is being taken in this new
invention."" As Mr. Bailey put it, 20
pounds is very little to pay if it pro
vides an armless man with the means
to amuse himself every evening for
the rest of his life. If it cost very
much more that that, it would still
be worth it. Fortunately, the num
ber of those who have had double
amputations of the arms is small.
This appliance, as Mr. Bailey de
scribed, is easy to understand. First
of all, there is an upright with a Knob
which goes between the big and the
second toe. The upright knoib is fixed
at right angles to n. Horizontal rod
which is fixed to the leg of the table
at which the operator sits. The hor
izontal rod is connected with a verti
cal rod five times its length on the
cati-lever principle.
The horizontal rod can be moved
by the foot upward, downward or
horizontally to right or left. The up
right rod has attached to it a metal
arm which moves in response to the
movement of the rod controlled by
the foot. The vertical rod being five
times the length of the horizontal rod
on the principle of the lever, greatly
increases the power of the ""arm"". To
the arm can be fitted various clutches
with which the operator can move or
pick up at will articles on the table.
With two ""arms"" at work he can do
many surprising feats.
An eye-witness of the demonstra
tion told me that the effect was al
most uncanny. One arm first took
up a cigarette and put it in the oper
ator's mouth and then took hold of
and gripped a box of matches. The
other arm, operated ot course, by the
other foot and attached to the other
leg of the table on the far side, push
ed the match box open and took out
a match. This was a delicate opera
tion, but it was successfully per
formed. The match was then struck
and the cigarette was lit. Again
these metal arms that act like human
limbs and almost seem is if endowed
with intelligence took a knife and
fork, cut up food and transferred it
to the mouth.
Mr. Thompson, the inventor, who
was the operator, also drank from a
cup, turned the leave of books, pen
cilled a design on a sheet of paper
and cut it out with scissors, worked a
typewriter, played a dulcimer and
wrote with an ordinary pen. He could
write quickly, slowly, and, what is
more important legibly. He showed
too, that it was possible to use a ham
mer and nails and to comb the hair
with the machine. Moreover, he de
monstrated how an armless man us
ing his appliance could actually wash
himself.
The machine has naturally, its
limitations. It means training for
tbose who use it and it involves sit
ting at a table and having an attend
ant to place thereon all the articles
needed for use.
To Heal a Conch
Take HAYES' HEALING HONEY.
35c. Adv.
For Colds. Grip or Influenza
and as a Preventative, take LAXA
TIVE BROMO QUININE Tablets.
Look for E. W. GROVE'S signature
on the box. 30c. Adv.
THIRSTY PEOPLE
FIND CASES IN
N. Y. TAXICABS
M&&$m WIa &yMmm&
If your husband did the ""wash""
you can be mighty sure he'd buy
T TmT Iff
Can you imagine the ""the man of the house"" rubbing the skin off his fingers at a wash-board ? ?
Do you suppose, for a minute, that he would do a week's ""wash"" in the way you do it ? ?
Not much ! He knows the value of labor-saving machinery. He uses it in the factory, in the
office,--even has a self-starter on his automobile. Yet you have gone ahead in the same old way tor
years to do the laundry work How foolish!
Mr-Man-of-the-House would get a washer and he would get a
Crystal Washer.
Here is the chance for you to get one for your own help; to
make washing no longer a task; to cut out the hard work of wash
day. Beginning Tuesday, the store opens a demonstration and Club
Sale of Crystal Washers. During that sale, these tried and speedy
devices will be sold on a special plan of easy payments. Under that
plan, you may choose a washer and have it in your service while
payment is being made.
Every washer will be sold with a distinct and absolute guarantee of satisfaction.
It must do its work as you expect if it doesn't, tell us to take it back !
The Crystal washes every sort of clothes with equal facility and sureness. Trust
your finest underclothes to it. Use it for your heavy spreads and staunchest of fine
linens. Each will come from its cylinder cleansed and uninjured.
That cylinder is big enough to hold quite a quantity of clothes. It goes round and
round and round at a great speed. The water, with its cleansing suds, is forced
through and through the clothes, taking out every speck, of dirt.
Then by a clever swinging arrangement, wringer is adjusted to wing clothes and
pass them to the rinsing water and the bluing in turn. While one batch is being blued,
another is being washed ! Time is saved, work is saved, washing is done in almost mar
velous period ! '.
Strange vessels these days are
Sruising here and there among: the
huge fleets that skim over the Big
City's popular througrhfares continu
ously, according; to the dark report
of those who say they have been cus
tomers. Stocked with hig;h-proof an
tidotes for snakebite, the old familar
brands of first-aid in case of ""flu"" or
chill, of nepenthe and balm of Gil
ead bottled in bond, these craft weave
in and out in the stream of common
traffic, and double back again, bound
for no particular port and held to no
earthly schedule.
Now and again one of these strange
craft detaches itself from the main
streams of traffic, and, as it rides at
some obscure anchorage, its passen
ger, or passengers lurch out and roll
away into the dry city, their facea,
lit with beatific sanctification. The
pilot, skipper, genie or this ""bflnd
pig on wheels"" cranks his craft, con
jures new essences, and. taking an
other fare, puts back into the heavy
traffic . currents, while the traveller
within, presumably, gurgles and
gurgles.
It is said that the passage-money
required by one of these craft tran
scends weak imaginations. It is also
said thero is no want of the stuff
that many famous surgeons want
brought back again, and that there
ia never a want of passengers.
mm
Niht
Morning
KepVbur Eyes
lean - C I o-e r- Healthy
V - rr a L. M..-I l -U. lies
NO DISTINCTION
OF GLASS MADE
AMONG CHINESE
Westerners are almost universally
convinced that China is a land of
classes and castes and of closely drawn
social distinctions; yet nothing could
be more untrue or unjust. As a mat
ter of fact, the word ""coolie"" is not
Chinese, and, outside of the narrow
coast belt of foreign influence, there
is no Chinese word which describes
such a class.
The poor are ""those who eat bit
terness,"" or ""those deserving pity;""
laborers are described as laborers.
and have their dignity; farmers rank
high in the social scale, and beggars
have their individual merits. But no
term serves to describe what ths
1-luropean calls the ""coolie class,"" and
tin Chinese thought it is non-existent.
' In China no hereditary class survived
the wreck of the feudal system in the
third century, B. C, but the members
of thie imperial family and the de
cendants of Confucius.
There is no country in which wealth
is so much sought after and so care
fully handled as in China, and yet
none in which money plays so small
a part in- determining a man's so-cial
status. There is no country, again,
in which ancestors are so much rev
erenced as in China, and yet none
in which man's forefathers and their
achievements have so little influence
upon popular esteem. In each gen
eration the individual is judged on
his merits, and, apart from moral ex
cellence, merit in China means schol
arship. The highest title in the land is no
higher than that of ""teacher"". The
son of the barrow coolie who makes
himself a master of Chinese erudi
tion may converse and dine with the
lordly, though his gown is faded and
greasy, and his poverty forces him
:o tell stories for a livelihood.
But see for yourself. Crystal washers are in use right here at the store. Watch
them then arrange to have one do your washing in your home.
Most women are a bit afraid of machinery, especially electrical machinery.
There is no need to be afraid of the Crystal Washer. It is built so simply that it is
easily operated. It is built so strongly that there is little fear it will get out ot order.
You can count on it as an always-ready utility for the home. .
Come! See and Believe! Then let a Crystal begin it
The Crystal Swinging Wringer '
The dot bet
are wtnn
from the ma
chine into the
note water.
wor
k for you with no loss of time!
THE HOWLAND DRY GOODS CO.
iritm fr Ftve Caro Book Murine Co, Chicago,
Because so few typewriter inks
re indellible or unalterable the Ven
swielan government has forbidder
he official registration of typewrit-
F or Golds or
Influenza and as a
Preventative
Take
""Laxative
Quinine
Tablets""
Be sure you get the Genuine
Look for this signature
The vital necessity in TIRE RE
PAIRING is the knowledge of HEAT
and the effect on rubber.
We know how to repair casings and
tubes PE1U ECTLY because we know
just what degree of heat to use for
to cure rubber correctly one must
nave the RIGHT steam equipment
and the knowledge.
You are certain of the finest work
when we repair your tires and our
charges are very moderate.
A trial proves.
United Tire & Vulcanizing Co..
Distributors of Firestone Tires and
Tubes.
342 Fairfield Ave., Bridgeport
Telephone 6030 Barnum
HELP WANTED.
Wc can use women experienced in paper box making on
the following operations:
Staying. Stripping, Finishing.
Piece work rates are most liberal and steady work
guaranteed.
Beginners will be instructed and paid on day work basis.
Apply Employment Office,
THE WARNER BROS. CO.
Seaside Institute. B18r
on the oox. 30e
Times Want Ads One Cent
a Word. Use Them
AN AID TO HEALTH PURE WATER
A healthful drink which is absolutely uncon
taminated by impurities of any kind. State License
No. 10.
BOTTLED DAILY. DELIVERED DAILY.
TELEPHONE 3S02-12
W. M. LANE, Distributor of
HIGHLAND SPRING WATER
jj j. D. NO. 1, BRIDGEPORT, CONN.
Mantler's Baby Shop
NO. 8 POST OFFICE ARCADE
TELEPHONE BARNUM 2378
SAMPLE DRESSES sT REDUCED PRICE
A most beautiful assortment of Embroidery Silks
md Crochet Cotton. Chinchilla, and Cfirduray Coats
for the little ones at reduced prices.
ADVERTISE IN THE TIMES BEST RESULTS",The Bridgeport times and evening farmer.
