city,state,date,lCCN,text,title
['McCrory'],['Arkansas'],19081029,sn90050109,"E. L. HAMILTON
FURNITURE AND STOVES
^NEW LINE Of POCKET And TABLE CUTLERY ^
mens
Canned Goods.
Call and inspect our line. We han
dle all kinds of canned goods. Afresh
supply of cakes. Fresh bread Friday
and Tuesdays. Best home killed meats.
JEFFRIES, MARSH & CO.
t
Window glass for sale at H. T.
Raney’s.
For Rent—Two rooms, er-'
quire Mrs. T. -1. Comer.
Born: To Mr. and Mrs. H. D.
Perkins a fine bov Tuesday, Cel.,
27, 1908.
Mrs H. W. Jernigan is enter-!
tabling Miss Helen Macnab, o?
Augusta, this week.
Miss Blanche Jones, who has
been the guest of Mr. and Mrs.
T. IS’. Taylor, left Tuesday for her
home iu Wynne.
Mr. and Mrs Dixon Swayzee, of
Benton. Miss., arrived here last
Saturday to be the guests of rela
tives for several days.
DeWitt’s Little Early Risei-s,
the famous little liver pills. They
are small, safe pills. Sold by
Howell Drug Company. |f
After several weeks stay in our
midst, trnior.t! mends and relatives
J. B. MeLetnore returned Tuesday ‘
to his home at Milan, Teun. !
-———— ~S
Married : Sunday evening at
3:00 o’clock at the home of the
bride’s parents, Mr. Harry West, *
age 17 to Miss Bessie Browning
age 16, Rev. H. T. Ranev officiat
es- ‘ '
C. L. ADAOSON,
Jeweler Optic-mi and Engraver.
Watches, Clocks, Jewelry i
Silverware, Etc. Etc.
ALL WORK GUARANTEED
TWELVE MONTHS.
REPAIR WORK A SPECIALTY.
ARKANSAS.
AUGUSTA,
FIRE
i FIRE
(
The next alarm may sound
at your house. I represent
the Calenonian, Royal, Teu
tonia, London & Lancashire
Ohio German, of Toledo,
Queen of New York. The
best line of fire and torna
do insurance that can be
had. Call or write,
G. W. BARBER
Miss Annie Dilliard arrived
Wednesday from Cherry Valley to
pend several days with her sister,
Jrs. W. A. Smith.
Mr. and Mrs. D. Jones returned
Sunday to their home at Judsonia,
ifter a few days visit to their
laughter, Mrs. J. A. Cullum.
Mrs. E. L. Pritchett, and chil
iren, left Wednesday for Bald
inob, where they will be with
Sirs. Pritchett’s parents till Sun
lay.
Kodol is a combination of the
rntnral digestive juices and it . di
gests all classes of food and every
und of food, so you see it will do
he work that the stomach itself
loes. The only difference between
t and the stomach is, the stomach
;an get out of order and Kodol
sannot, but Kodol can put the
stomach into good order. Buy
iodol today. It is guaranteed.
Sold by
CAN TRUNDLE HEAVY LOADS 1
Chinese Coolies Able to Transport
Nearly Half a Ton on Peculiar
Wheelbarrow.
In the wheelbarrow used in China '
the wheel is set in the center, and
this supports practically the entire
load, while the handles are support
ed in part by a strap or rope over
the shoulders of the man who oper
ates it.
As a result the coolie in China
will transport nearly half a ton on
his wheel. Wheelbarrows are much
used in the country, where the roads
are but little developed, and we
have heard that passengers some
times make the entire trip from
Shanghai to Pekin, a distance of
600 miles, by barrow.
A two-passenger barrow will make
about 20 miles a day, and the coolie
is content with a pay of about 20
cents a day, or an average of about
half a cent a mile for each passen
ger. On the level, well kept streets
of the foreign quarters of such cities
as Hong Kong, Shanghai and Pe
kin the wheelbarrow coolie will
struggle along with a load of six or
even eight people.
IS HEAD OF HER FAMILY.
The Dutch woman of South Afri
ca is the head of her family and
must be obeyed by husband as well
as children. She marries very young
and has a large family. The wo
man of the cities is very different,
having a good education, and when
she finishes in Europe she is a most
attractive creature, with great ca
pacity for enjoyment. She is likely
to be musical, but not literary, as the
Dutch of that country have not
reached that phase of development.
The women of South Africa are
very much taller than the women of
Holland, and the city-bred girl is
generally slender and rather pretty,
which the Boer woman never is, be
ing fat and figureless at 30.
OLDEST DATED DECORATION.
Probably the oldest dated decora
tion in the world has recently been
brought to light by the discovery of
the funerary temple of King Sahu
ra, who lived 2,500 B. C.
It lies between the Pyramids of
Giseh and Saggarah, and has been
unearthed by Dr. Borcharts, direc
tor of the German institute of ar
chaeology at Cairo. Sculptured has
reliefs illustrate Pharaoh conversing
with the gods, conquering the Ly
bians, and receiving an embassy. Be
sides this there are hunting and fish
ing scenes, and most interesting of
all, a fleet of ships of the period.
ANCIENT WAR CLUB8.
Clubs were the weapons of primi
tive and savage men. Ancient speci
mens from Mexico are heavy sticks
grooved along the side for the inser
tion of blades of obsidian—that is,
volcanic glass. The Sioux club is ■
a Hat piece of wood, curving and
widening away from the grip, and
terminating in a spherical head,
which in modern times carried a
long spike, while the blades of sever
al butcher knives are commonly in
serted along the margin.
HAD A WIDE CHOICE.
On the occasion of the late jubilee
of the town of Wilhelmsburg in
Germany the burgermeister re
ceived a telegram, signed by all the
unmarried girls of the place, advis- 1
ing him to get married and saying 1
that none of the undersigned had
any objection to becoming a frau i
burgermeisterin. ,
COLD STORAGE.
“Yes,” said Miss Baclcbay, “Em
erson appeals to us women of Bos- ,
ton. Although he has passed be
yond we always keep him in our
hearts, you know.” '
“You don’t say,” replied Miss
Gotham. “I wcpder how it feels to 1
be kept in cold storage like that aft- 1
er death.” ]
CAUSE OF HIS HILARITY.
_ I
Green—I’d like that fellow Brown 1
better if he didn’t always laugh at i
his own jokes.
White—Brown doesn’t laugh at
his own jokes. He laughs at yodv
fellows who are silly enough to lis- .
ten to them.—Illustrated Bits.
HAD HIM.
Cynical Man—Nature must have
been dreaming when she made wom
en.
New Woman—She must have had
a welsh rarebit nightmare when she
made man,—Bohemian Magazine.
Clair C. Carson, of Jonesboro,
was the guest of McCrory relatives
Monday and Tuesday.
For Sale : Second baud bug
gy in first-class condition. Ap
ply to Mrs. John C. Veazey.
Robt. M. Johnson returned Sat
urday to Memphis after a few days
visit to home folks in this city.
H. F. Kittrell and wife, of Au
gusta, were pleasant guests at the
home of Dr. G. B. Fakes, the first
of the week.
Keith H. Carson who is now
working in the Rock Island office
it Cotton Plant spent Monday with
home folks in this city.
J. P. (Hot) Taylor left Monday
for Forrest City where he will
probably reside in the future. His
family is at present visiting in
Searcy.
Hon. D. L. King, of Hardy,
Presidential Elector for the Second
District, made a couple of personal
iddressesto one of our voters (?)
in the western portion of our city
this week.
Hon. L. C. Going Democratic
Nominee for Presidential Elector,
will speak in behalf of the Dem
ocratic Ticket at Wherry’s hall in
this city Saturday, October 31, at
L :30 p. in. and at Augusta at 7 p.
m. Everybodj' attend.
Burns, bruises and scratches, |
big and little cuts or in fact any- I
thing requiring a salve, are best
md quickest soothed and healed
by DeWitt’s Carbolized Witch
Hazel Salve. The best salve for ;
piles. Be sure you get DeWitt’s. |
Sold by Howell Drug Co.
Last Saturday morning Prof. J. |
B. Sherrill went to Jelks where he
iwaited the train which would '
jarry him to Newport. Prof.
Sherrill was most royally escorted
:o Jelks by thirteen of his pupils
who had taken a course of book- ,
keeping under him. 1
Do not let any one tell you that
something else is just as good as
DeWitt’s Kidney and Bladder
Pills because there isn’t anything
just as good for weak back, back
iche, rheumatic pains, inflamma- .
iou of the bladder, or any Kidney
md Bladder disorder. A week’s trial
will convince you. Sold by How
;11 Drug Co.
Courage and effort alone are re- i
juired to insure victory to the
vortky. In the struggle of life
he good is the more powerful.
[t is only when the giant lolls by
he wayside that evil creeps upon 1
urn and inflets its wounds. “Thrice '
s he armed who hath his quarrel
just” is not idle adage.
i
The progress of cities is meas
ired by the public spirit of their
nbabitants. Men whose ouly in- ^
;erest is in the success of their in- (
lividual business may make money (
!©r themselves, but they cannot ,
mild successful cities any more
han a pile of stones can furnish
sustenance for growing plants. ,
1
WOODMEN UNVEILING.
On Sunday, Nov., 8th., at 3:00 |
I’clock p m. at the Odd Fellows’
•emetery, the Woodmen Of the
iVorld will unveil the monument
>f their dead sovereign, Hal Free
nan. Every body attend.
STACY-GREEN.
Augusta, Ark., Oct., 26. Quite
i surprise oecured here Sunday
vheu Conner Stacy called at the
■esidenee of T. C. Green, osteusi
)ly to take his neice, Miss Helen
jlair Jackson, buggy riding. They
Irove directly to the Methodist
larsouage and were married by the
Rev. Halloway, continuing immedi
itely their drive twelve miles east,
;o McCrory, where it is under
itood they took an east bound train.
VIr. Stacy owns considerable farm
ng lands, as well as city proper
;v, and both families are quite
arominent.
ANDREWS LAST COURT.
Prosecuting Attorney P. R. An
Irews, of Augusta, was in Little
Rock last night enroute to Helena
o attend circuit court, which opens
tn that city today. This will be
Mr. Andrews’ last court as he re
MEAT NOT50 HIGH
THIS WEEK
Business is most success
ful when the transaction
of same is a source to YOU
as well as the merchant.
Knowing this as we do,
we are going to please you.
For a while we are going
to sell you a 25c Coffee for
20c per pound. We have
coffee from 10c per pound
to 35c per pound.
Yours for Business,
J. 0. Raymond.
We want 1C00 dozen eggs.
B
Dr. E. L. Chaffin,
DENTIST.
My work is Frst-class and my prices are
ieht. Twenty years' experience. Office at
:Ity Drue Store, McCrory, Arkansas.
:ires from office here next Satur-!
lav. R. J. Williams of St. Frau-i
iis county will succeed Mr. An-1
Irews as prosecuting attorney of j
hat district. Mr. Andrews stated
ast night that he had made all.
irraugemeuts to remove to Helena, j
vhich city will be his future home.j
—Little Rock correspondent in I
Memphis Commercial Appeal,
Dot 26.
Swastika Club
The Swastika Club was enter
arned at its last regular meeting
>n last Saturday by Mrs. Ed Jeff
•ies at her home just west of town.
Although it was a rather chilly
ind unfavorable day quite a num
ber of the members were present,
kfter quite an interesting business
irogram, Mrs. Jeffries served
lainty and delicious refreshments,
luring the partaking or which the
nenibers enjoyed the social fea- j
;ures of the club.
We left at a late hour all de-!
daring Mrs. Jeffries an ideal hos-1
ess. The next regular meeting of
he club will be with Mrs. Jerni-;
pan ou Saturday, November9, '08. •
Press Correspondent.
Trade Marks
Designs
Copyrights Ac.
Anyone sending a sketch and description may
quickly ascertain our opinion free whether an
Invention is probably patentable^ Communica.
tions strictly confidential. HANDBOOK on Patent*
lent free. Oldest agency for securing patents.
Patents taken through Munn A Co. receive
fptcial notice, without charge, in the
Scientific American.
A handsomely Illustrated weekly. Largest cir
culation of any scientific journal. Terms, $8 r
vear; four months, $1. Pold by all newsdealers,
SUNN &Co.36,Broa<^-New Yo:t
Branch Office. <26 F Washington. D. C
50 YEArtli'
EXPERIENCE
Subscribe now for the News,
iV'oodruff county’s leading paper.
Subscription rates; one year,
E>1.00, six months, 65 cents, three
nonths, 40 cents.
□ENERAL DIRECTORY.
Court Sessions.
Circuit Court, Northern District,—Meet
rhiril Monday in February and August. Sou
hern District—First Monday in March and
September. H. N. Hutton. Judge; Will
doorman. Clerk.
Chancery Court. Northern District.—Meets
first Monday in May and December. South
:rn District—Second Monday in February and
September. Ed. D. Robertson. Chancellor:
Will Moorman Clerk.
County Court.—Meets First Monday in Jami
try, April, July and October. J. F. Sommers,
radge: T. E. Simpson. Clerk.
Probate Court.—Meets Fourth Monday in
ranuary. April July and October. J. F. Som
ners. Judge: T. E. Simpson. Clerk.
Public Examinations.
Teachers' Public Examinations—Third Thura
iay and Friday in March. June. September
vnd December.
Cwunty Officials.
Senator
liepresenative
bounty and Probate Judge
Circuit Clerk
Jounty Clerk
^herilf
rreasurer
Coroner >
Surveyor
Assessor
Sxaminer
M. H. Patterson.
E. M. Carl-Lee.
J. F. Sommers.
Will Moorman.
T. E. Simpson.
W. R. Cain.
C. B. Mills.
Steve Davis.
E. L. Billengslea.
W. B. Fakes.
A. L. Hutchins.
Kennedy’s
Laxative
Cough Syrup
Relieves Colds by working them out
jf the system through a copious and
wealthy action of the bowels.
Relieves coughs by cleansing tha
nucous membranes of the throat, chest
md bronchial tubes.
“As pleasant to the taste
as Maple Sugar”
Children Like It»
Far BACKACHE-WEAK KIDNEYS Trj
la Witt's Kidney and Bladder Pllte—Sure tad Safi
inns?!—Z5VSal*”l=mr S—WJ j*u» *
I H. T. RANEY,
I The City Undertaker
| ALL SIZES AND STYLES OF
\ COFFINS, CASKETS, ROBES
And Burial Supplies. Hearse in connection.
inlmtlnlnjilrCriWnM^ iTLrtnjtrMmtrijCruOiytHVtrtn-n.rtnrtnf'Lrtri'rV i utwv5",Woodruff County news. [volume]
['Washington'],['District of Columbia'],19350501,sn84026749,"“Oil for the lamps of China” ♦ ♦ By Alice Tisdale Hobart
Western Life, Love Clash With
Ancient Ways of the
Far East
'(This is a serialization of the Cosmopolitan produc
tion soon to be released by Warner Brothers.)
WHAT HAS HAPPENED
(This is a serialization of the Cosmopolitan produc
tion soon to be released by Warner Brothers.)
Stephen Chase, youthful and ambitious,.is a field man
in Manchuria for the American Oil Company. When he
had devoted three years to the work, he arranged for his
furlough, during which he planned to marry Lucy, his
American sweetheart.
But when the time came Lucy refused to go through
with the marriage, on the grounds that Stephen was now
a veritable stranger.
Bewildered, Stephen marries the first girl he encount
ers in Yokohama who proves to be Hester Wentworth,
whose father had just died on a trip to China and who is
now alone in the tcorld. The couple start housekeeping
in a company hut in Manchuria, but Stephen spends most
of his time traveling in the vast Manchurian wastes.
He conceives an idea to have the company manufacture
and sell cheap lamps to coolies, thus increasing the oil
output tremendously. But during his travels he ivonders
if he had done right by bringing Hester to this terrible
country, tvhere she zvas forced to be alone a great part
of the time.
NOW READ ON
CHAPTER IX
Hester was, in fact, happy in the town hugged in between
the icebound river and iron earth of the winter plain from
which the high wind flaked off bits, sifting them over the
snowlike rust. In her sitting room, in her bedroom, the fires,
with their coals beautifully arranged in rows, seemed never
to die; the hand of the coolie built them perfectly, so that
when the coal turned to ash the structure of ash stood as
the structure of coal had stood.
Amah, speaking no English,
hovered about Hester. Her soft
black eyes spoke only of one
thing, service. Gently her fin
gers moved over Hester’s hair;
with butterfuy touch she pow
dered Hester’s shoulders, her
arms. She did all she could to
make her lady beautiful, as
Kin had commanded her: Keep
her in idle, enervating ease,
flawless, for the master; she
the possession of the master.
The first night she had spent
alone was a strange and mem
orable experience. So long as
Stephen was there, she had
held at bay the nameless fears
which had lain in the unex
plored recesses of her mind. She
had gone to the station with
her husband in order to hold
off until the last moment the
coming to grips with her fears.
She did riot tell him this. No
word of protest passed her lips.
The Company should find no
weakness in her to lessen the
Strength of Stephen.
When the train had disap
peared into the brown haze of
the spent duststorm, she then
walked from the station, fac
ing alone the array of ricksha
shafts raised like the swords
of fencers, hemming her in,
the men’s unwashed bodies
excuding the odor of garlic and
the unrecognized sweet odor of
opium.
New Danger
Then her •'funk,” as she
called her terror, had closed in
upon her. But she managed to
choose a ricksha, seat herself
in it and she was running clear
of whatever menace was in the
crowd when a new danger
assailed her. She could not
speak to her puller, direct him;
he was running away with her
straight to his own lair in the
Chin.ese city.
Somehow, by taps on the
side of the ricksha, by the
Chinese words for ""Gos”
“Walt!” and spoken rather too
loudly, she had managed to
direct him until the house-door
closed at last behind her.
The cook who was in charge
In Kin’s place had slipped away
after paying the ricksha man.
The amah, taking Hester’s hat
and glovM, had stumped off on
her bound feet like a little
club-footed animal. All at once
the Chinese seemed natural to
Hester, a race serving her,
guarding her. She had ex
amined the fear which had
looked darkly In on her ever
since her coming, and thus
could dismiss it.
’ Hester walked slowly along
the hall into the living room,
sitting for a moment in Ste
phen’s chair, then into the bed
room, moving lightly back and
forth, her spirit seeking its own
home within this house. The
month of happy days and the
nights spent here seemed no
longer to envelop it.
She took out needle and
some thread and began mend
ing a hole in the rug, taking
pleasure in the long needle go
ing in and out, stitching her
service into the Company house.
The coolie, seeing her thus,
JLWu i
7*«ZepAon« Dlctrict 7000
knelt by her side, ""Please, mis
sie, I do,” and he took the
needle gently from her. Hes
ter got up, remembering what
Stephen had told her about
""face.”
The afternoon moved slowly,
each minute spinning itself into
nothingness. When the hour ar
rived that before had brought
Stephen from his office, the
coolie came with the lamp and
the cook with tea. At 7 o’clock
dinner was announced and she
sat alone at the table.
At last the servants went to
their quarters and she lay down
in her bed. It was the first
time that she had ever spent
the night completely alone in
a house. Lying straight and
still in the dark, her heart
searched out the mysteries of
her new submission, this union
with Stephen.
When the windows became
gray squares and the first
rumble of the carts could be
heard, Hester’s thoughts turned
to this white man’s town, un
known and unrelated to her as
yet. Today she must make her
calls. It seemed officious, a new
comer, calling on women she
had never met. But Stephen
had said this was the custom.
That afternoon she started
forth, admiring her own calm
ness as she sat in the ricksha,
her hands in their white gloves
lying in her lap lightly clasping
her card case. Adroitly she ne
gotiated the first, the second
stop. No one at home.
The word ""Out” filled the lit
tle space above the slit where
cards could be dropped into the
neat boxes fastened to the gate
posts. With some disappoint
ment she deposited her cards,
wishing she might know what
the houses and the people hid
den behind the high walls were
like.
At the third stop, “Missle
have got,” said the gateman
when he came in response to
her knock. What did he mean?
Well, evidently that his mistress
was at home, as the word “In”
was clearly displayed above the
card box.
Through the half-open gate,
Hester saw a vista of walk bor
dered by the pompomed heads
of a thousand chrysanthemums
rising proudly from blue and
green glazed pots. Straight
down the long hall the white
robed houseboy led her. The
braid of his queue hung like a
glossy black rope almost to the
hem of his snow-white robe. Hes
ter made a mental note that she
would have Kin dress like this.
Kin’s gowns were of dark blue
and usually unironed, simply
stretched into shape by hanging
on a bamboo pole thrust
through the sleeves.
Another Group
Now they had passed into an
other garden. With surprise,
Hester saw three tennis courts
shut in by the house and the
compound wall, a hotly con
tested tournament in progress.
(Copyright. 1934. by Bobbs-Merrell Co.
Dlotrlbuted by King Foatureo
Syndicate. Inc.)
To Be Continued
SECRET AGENT X-9 By Alex Raymond
|| I HAVEN'T TOLD YOU BECAUSE I DONt] BUT I TELL YOU THAT BACK IN THe""| I WHAT'S THAT? I WITH HIS OLD MAN THESE OUTLYING HOUSES ”
KNOW. I WAS A KID WHEN ICAME BANK IN OKLAHOMA THE SECRET A PLANE ? KILLED, TH AT BANK IN SPOTS LIKE THAT ARE
... DOWN HERE — ALLI REMEMBER IS MAP OFTHE OIL WELLS IS IN r ” — yr-' IS HOT. BUT ITS A WORTH CHECKING ON-THERSS
With nine tsa great rocks the wall safe., RA million dollars and an ideal hideout. ,
INFOR- -’’WPS-NEAR THE < — J BACK WE GO! WE'LL CRACK M —>■
MATION PLACE J |IT TONIGHT. I'LL GO j— I , JXX \ ""zZ —
dM J — V 7
young .Zm AlVr the y/y...
s' oWiESm
claw il v,\ ii\ Fb W Yr
Perate _ W/ ak njR
expuxt ■ WTUIJm I. MM Ja V
PIECES OF EIGHT By Charles B. Driscoll
/ he'sgdin 7 a mW
On deck, Captain Bonnet summoned all hands, Presently fifty men were swarming over the slbop, Immediately, the fight was featured by a contest The fire had not reached the mainmast, but It
and ordered all but a few men to board the burning fighting the fire with buckets of water which were of strength and endurance between Scud and the was gaining headway. Up the mast went Pedro,
Good Hope and put out the fire. He ordered Pedro dipped from the ocean at ropes’ ends, with wet mysterious Pedro. Each performed miracles of dar- carrying one end of a heavy line. Nobody knew
to go with his men, but warned him against dis- blankets, and with the pumps. Scud Skorry, of the Ing and herculean labors. The men of the Royal what he was up to, but none questioned him, for he
closing the hiding place of the gold. Good Hope’s company, joined the fire-fighters. James were awed by such prodigious powers. had proved his cunning and valor.
™ TYLER’S LUCK ~ By Lyman Young
i “I | MARCEL, EMERGING FROM THE DOORWAY /S, ’
IBWIIaIT ) ■ NIMBLY DODGES A its markas-one\ ’ ■
, J lit -j-. OF THE COUNT'S SPyiNG V ■
RxAal BV ' dSc-QvSl CUTTHROATS/SILENCED /yj ■
/Xv I Ip forever, but it JA M
® was his life / Via
'J -OR MINE/-/ y
■ ■> , /mml
trl/TgiF
RED BARRY will Gould
=AN.Ib L I CAtAT UMDERSTAND U ITS MO fAYSTEKY . V JMmT . • fQ
4AS AN H IT-IN HER CONDITION. TO A WOMAN. < Ipj] ■ J ‘ >
OF AU I THOUGHT THF SHOCK B DOCTOR""'MOTHER :
3'LL BE / WOULD SURELY KILL \ L KNOWS HOW TO < f"" ■ M V )
:IN A J HER ""ITS A MIRACLE )/ FIGHT- FOR V ■hrF7,arl ; <■■ Su
♦ mUI 7 THAT’SHE'S LIVED r HER JOHNNY../ £77 X •’
-ffnlr C. THRU IT ALL !! : ■■ ?
I nT 1 j n 'X
sTi / ww x :
ov/.- < xwot B I 'HA /F y -\ l
* f SB I ¥ H @> Mt> QUICKER THAN IT
z i V Hfi| TAKES TO TELL IT. RED ‘
1 \\Tl —tsar FORCES THE WINDOW AND
JwaTw J/i ill R«i O H THE FIKE ESCAPE AT . HURLS HIMSELF AT THB P '
S7i — YlaTr/ GRIMSHAW'S HIDEOUT'"" UNSUSPECTING GRIMSHAW-. <
MANDRAKE THE MAGICIAN By Lee Falk
Il AGAIN LOTHAR SWINGS HARD I I AND AGAIN TINTO LUNGES FOR-” I L-OTM AR IS ”
AT THE HUGE SERPENT’S JAW-- WARD WITH TERRIFIC FORCE AND KNOCKED HEAD- PKT ’ AFTKR H,M M
THIS TIME DOES NOT MISS—- UONGDOWNTHE
stairs with MB®
TINTO IN CLOSE -I B
Zc in PURSUIT. L/U Him I «W
Mandrake's fc 1 Hil i life* ‘
SERVANT, \ >1 '
BATTLES < S 3 X Il 11 -J ‘
professor jb
GIGANTIC T W J 111 \ K\
SERPENT. \ II /)
K QoiMig=ii\ 111 .. z
R A' Mn"" IZ'7,- r„, TOMORROW-- HELP.
BOBBY THATCHER By George Storm
Bmp’ % r BUT THAT’S SO Cfi, _
/ LONG AGO IT’S NOT J iwCzA M
z x I likely she’d H
IflM Jy remember what fl fl t I.J H 1
REMEMBER jT
AUSE BANKER k Jz V* Z . A
(MB’S WIFE y A THERE SHE /
/AS PASSIN’ Q ly<l v J jat [A 15 NOW... X JCf J-T
it HAT.S, ’N* X wf ZtjM jUv- WONT DO
MTS,’N*. SHOES I ■ f fA 7 ANY HARM
•O EVER’BODY J Mff MH I )' TO ,60 IN
ALONG THE ’ N ASK * J
river. ) -T- —4'iWw >|B7ai
3 i f
THE WASHINGTON TIMES, WEDNESDAY, MAY 1, 1935
TefapAona Dlttrict 7000",The Washington times. [volume]
