city,state,date,lCCN,text,title
['Helena'],['Montana'],19600325,sn86075189,"V
lab / A 'f *
M
l...
V.r<y
1 C
M 1
TWO 2 mm
<3
a
nmn r r r
WIDE INDEPENDENT NEWSPAPER
MONTANA'S ONI
1958 Sidney Hillman Award Winner
so
. Q-S
- ■
&.? i.00 Per Year
""
Vol. XXI—No. 16
HELENA, MONTANA, MARCH 25, 1960
Farmers Union Adopts P
Hears World-Famous Speakers
ii
DENVER, Cuîo.— -Delegates to the annual convention of*
the National Farmers Union adopted resolutions calling for a
strong farm program and heard unusually significant speeches
from world farm leaders and outstanding figures in the United
.States.
The most unique feature of the convention was an address
by F. of New#——-—----———
York City, who has not previously
ventured into the mid-West. Wagner
was invited by NFU President James
O. Patton to represent the 6,800,000
consumers in the nation's largest city
at a time when enemies of the farm
-, program are stirring up consumer
revolt.
The New York mayor, who is some
times mentioned as a Vice Presiden
tial possibility, responded with a vig
orous defense of the farmers and a
strong appeal for more utilization of
farm surpluses in the feeding of
starving people. He also asked farm
ers to understand the problems of
city people,
' This year's Farmers Union resolu
tions were not markedly different
from those of recent years. Although
proposed legislation was not men
tioned by name, the organization's
program for I960 points quite direct
ly to the support of bills by W. R.
Poage and about twenty others in the
House, as well as bills by Senators
Hubert Humphrey, Stuart Symington
and William Proxmire.
COMPREHENSIVE SYSTEM
CALLED FOR
As a means of getting ""bargaining
power,"" the resolutions call for a
comprehensive system of commodity
programs adapted in workable ways
to the different commodities"" and call
for unity among the farm organiza
tions to accomplish this goal.
""Such programs should be de
veloped for all commodities,"" the
delegates said, ""when producers
are willing to adopt and enforce ef
, fective measures to keep market
supplies in balance with demand.""
The resolutions stated that guide
Upwards of 1,000 Hear
Thatcher at GTA Banquet
I didn't know there were
so many ways to skin a farm
er,"" said Farmers Union GTA
general manager, M. W.
Thatcher, in Reviewing how he
first became interested in farm
ers and their problems, up
wards of a half century ago.
Thatcher was the principal speak
er at GTA 's 12th annual school ban
quet in Great Falls last Friday eve
ning. Upwards of 1,000 Montana
farm people heard the longtime man
ager of the regional co-op speak.
Introduced by Montana GTA man
ager Jule Waber as ""the man who
has done more for the grain farmer
than any man who ever lived,
Thatcher reminisced on how he, as a
young accountant fresh out of Chi
cago, became what amounted to an
""angry young man"" over the plight
of grain growers at the hands of
Twin Cities commission houses.
He recalled how, when the Non
Partisan League came into power in
North Dakota, he was able to get
laws enacted to give some protection
to that state's grain producers. How,
later on he came to Montana and
set up an accounting office in Great
Falls.
Emphasizing ""you've got to have a
farm organization to build and keep
your co-operatives,"" the GTA head
told of his efforts to establish Mon
tana Farmers Union, and the opening
ii
%y
line for a comprehensive program
should provide for;
• Administered farm prices to be set
yearly ... by national farm income
improvement committees made up
of democratically-elected farmers;
• Establishment of national goals
sufficient for domestic and export
use requirements at prices that will
enable farmers to earn and get a
fair part of national income;
• Government^ with the advice of
farmer committees, should deter
mine the national need for farm
products, for the commercial mar
ket, domestically and for export
for dollar sales without subsidies,
plus the additional amounts that
are required by the government to
carry out domestic welfare and
foreign policies of the United
States.
Methods recommended for achiev
ing the goals include loans, farm in
come deficiency payments, marketing
agreements and orders, marketing
premium payments, stabilization op
erations, and a system of marketing
quotas.
QUOTAS AND ALLOTMENTS
Discussing the achievement of bar
gaining power by management of
abundance the resolution states;
'^Marketing supply controls should be
expressed in terms of commodity
units such as bushels and pounds or
as acreage allotments, pr both, as
required for most effective operation
of the program. Where unit market
ing quotas are used as the exclusive
supply control method, each farmer
(Continued On Page Eight)
of an MFU office in Billings in 1926.
Another big battle he recalled hav
ing am active part in was the securing
of a premium payment for farmers
on the basis of protein content of
wheat, and how success was finally
achieved in 1928. Before that time,
he said, farmers got nothing for high
er protein content, the commission
men took it all.
WITH FDR IN 1933
The next big step he said, came in
1933 on the heels of a disastrous pe
riod of years for farmers, when Pres
ident Franklin Roosevelt enlisted his
assistance and guidance in drafting
the first farm legislation of the New
Deal, and how that legislation laid
a basis for a stable agriculture which
was to endure until Ezra Taft Ben
son came into authority in the De
partment of Agriculture.
The building of co-operatives,
Thatcher said, has been a driving
force with him for more than four
decades, and he briefly recounted the
changes in co-operative management
and operatioh in the years since the
end of World War I.
""By building co-ops,'' he said, ""we
build tools for farmers to use."" These
tools, he continued, and the increased
income they've brought to Montana
has been good for everybody in
Montana.''
GTA today, he said, is growing to
a size that it can be a tremendous
(Continued On Page Four)
v *
of*
Over $11,000 Per
Acre Paid Dr. Crissey
For Right-Of-Way
Dr. and Mr«. V. V. Cri»«ey this
week received $170,000 in payment
for right-of-way for Interstate 90
and the cloverleaf access routes to
Livingston on U.S. Highway 89, ac
cording to PARK COUNTY NEWS.
Montana Highway Department
purchased 15.36 acres from the
Crisseys at an average price of over
$11,067 per acre.
The above information was vol
unteered to the NEWS by Dr. Cris
sey. It answers the question raised
in last week's VOICE editorial:
""Are there still further right-of
way purchases in the offing which
will run into five-figure amounts,
in the Livingston area?""
The Highway Department has
been extremely reluctant to give
this information out. All this week
the PV'» capitol reporter has been
accorded a great big run-around
in attempting to check reports re
ceived by this office that some
gold-plated land has been ac
HLB
more
quired near Livingston.
Labor To Hear,
Back Candidates
At Convention
The Montana Committee on
Political Education AFL-CIO
will hold its convention in the
Eagles Hall in Helena, April
9th, James S. Umber, president,
announced Wednesday.
The prime purpose of the
pre-primary convention will be
to screen and endorse candi
dates for state and national of
fices.
All such candidates of both
major political parties are in
vited to attend and will be giv
en an opportunity to address
the delegates.
More than 100 delegates
from all sections of the state
will be in attendance, Umber
said.
In the screening process each
candidate will be asked to state
his or her position on issues of
importance to members of or
ganized labor.
The answers to these ques
tions and any past record of a
candidate will be given careful
Consideration by the convention
before an endorsement is made,
Umber concluded.
FTC Complaints Quadruple
NEW YORK CITY—(CNS)—Fed
eral Trade Commission is getting five
times as many complaints about ad
vertising as it did before congressmen
dug into television quiz shows.
FTC's chief, Earl Kintner, said here
recently that the agency was get
ting 200 complaints a, month from
persons who cited newspaper, maga
zine, radio, and TV ads they believed
to be fraudulent. This has now risen
to 1,000.
OF MONTANA
HELENA
Bradford Contends . .
Harry Burns Has 'Careless
Disregard For the Truth'
The controversy, State Highway Commission versus the
People of Montana, continued to flare this week with 1959
Highway Investigating Committee chairman Truman Bradford
(D-Cascade) publicly castigating Commission boss Harry Burns
as one who has a ""careless disregard for the tuth . . .
Bradford issued a public reply to the letter Burns recently
wrote to U. S. NEWS & WORLD REPORT protesting certain
portions of an article dealing with the nation's $40 billion
highway program.
99
Burns in his letter, had asserted
(see VOICE, March 18) that Brad
ford and a majority of his legislative
committee were ""dupes'* to a con
spiracy to do harm to ""responsible
government and eventually for the
destruction of America itself.'*
Countering, Bradford says
""whether duped or not, we certain
ly did the State of Montana a great
service by bringing to light the
disgraceful waste of our highway
money . . .'' And, suggesting that
the people of Montana be the final
judge, Bradford urged Burns to
file for Governor that the voters
might have
place their stamp for approval or
disapproval upon his conduct of
the highway commission's busi
ness.
In a prepared statement, the Cas
cade legislator, a direct descendant
of the Bradfords who helped to
colonize New England, quoted the
sections of the NEWS article Burns
had found objectionable and then
stated pertinent facts as brought out
during his committee's investigation.
The statement follows;
opportunity to
• *
an
yy
""In the March 7fch edition of the
U. S. News & World Report, under
the heading ""$40 Billion Highway
Program In Trouble"", appear the
following paragraphs;
• Complaint; A road ""sank"".
Shoddy workmanship and poor
planning are the basis of other
complaints heard by the investi
gators. Among these are;
A 12-mile highway project
that included a bridge over a
river was built on unstable
ground. Since the latter part of
1958, part of one of the ap
proaches to the bridge has sunk
about 12 feet. The estimated
cost of reconstructing the ap
proach is said to be 1 million
dollars.
• Original planning for one
project called for routing a sec
tion of highway around a hill at
a cost of between 1 million and
1.5 million dollars. Later, it was
decided to make a deep cut
through the side of the hill. Al
though no core drillings were
'Coolie' Philosophy Draws Blast . .
/
S
Work-for-Less' Theme
\
I am astounded at the re
marks of E. O. Sowerwiae, di
rector of the State Planning
Board,"" James S. Umber, pres
ident of the Montana AFL-CIO,
said in Helena last week. ""His
reference to low wages and
low living standards in Hong
Kong which have brought
about industrial development and his
inference that this -is the way in
which to attract industry to Montana
is enough to frighten even the most
mercenary citizen of this state.
. *
Umber made his comment follow
ing a news release on a speech Sower
wine had delivered to the Missoula
Rotary Club.
It ill befits the man employed by
Montana taxpayers to preach the doc
trine of 'coolie' status for the work
ing citizens of this state, while at the
same time defending the discrimina
tory freight rates that cost Montana
producers and consumers so heavily.
I.
is among the nation's highest, but the
wages are not.
""Mr. Sowerwine should know the
productivity of Montana's workers
""He should know that the sale of
commodities, cars, appliances, homes
made, it was assumed that the
contractor would meet solid
rock.
The ""rock"" turned out to be
shale. When digging began, al
most the entire hill started slid
ing. The shale had to be cut back
at an angle—an operation far
more expensive than a rock cut
through, which leaves approxi
mately vertical embankments.
This led to an ""extra-work ord
er"" which is expected to add al
most 100 per cent to the orig
inal estimate of the entire proj
ect's cost.
• In another instance, a dam
proposed by a federal agency
would, if built, flood a 10-million
dollar portion of a newly con
structed section of the interstate
highway system.
' '
According to his press release of
March 16th, Chairman Burns of the
Montana Highway Commission had
no trouble at all in deducing the, fact
(Continued On Page Five)
Great Falls Diaaer
To Open Graybill
Congress Campaiga
GREAT FALLS—A Graybill for
Congress campaign kickoff dinner to
acquaint voters with qualifications of
Leo Graybill, Jr., Democratic candi
date for Montana's Eastern District
seat in Congress, is scheduled at De
Molay Memorial March 31 at 6:30
p.m.
Rep. Harold O. Gunderson, general
chairman for the dinner, said Gray
bill, a Great Falls attorney, will dis
cuss the issues in the campaign and
answer questions at the meeting.
Police Magistrate George Anderson
will be toastmaster. Mrs. Gene Daly
and Mazie O'Connell head the table
decoration committee, and Jean Chap
pel, Mrs. John Harrington, Pat Toole
and Nell Wheeler are on the hos
pitality committee.
Reservations for the dinner may be
obtained by calling GL 3-1383.
I and services is based directly on wage
ea ^ ( I lf rs ' pay^ecks.
is, then, a direct threat to the econ
omy and the shopkeeper.
""Who will purchase the homes, ap
pliances and cars produced by cheap
labor?"" Umber asked. ""Mr. Sower
wine drives a foreign-made car. Is
this what he expects from us all?
Cheap foreign labor and goods in
competition with free enterprise? Mr.
Sowerwine's 'better business climate'
and Hong Kong philosophy is the
stupid thinking of the man who would
improve a race horse by cutting off
his legs.
""If Montana wants to plan eco
nomic 'hari-kari', there are already
enough bunglers in the State Capitol
to accomplish that end,"" Umber
stated.
I have been a member of the
a
advisory committee to the State Plan
ning Board for a number of years,
Umber said, ""and this is the first
time I've ever heard of a 'coolie'
philosophy being advocated to create
a 'better business climate' for any
state.
yy
The so-called 'business adminis
tration' of the Aronson bunglers
should be proud of Mr. Sowerwine,
Umber concluded.
y>",The people's voice. [volume]
